category,title,description,blogger,date,link,sentiment_score,sentiment_interpretation,search_query,search_lang,collected_at,platform,sort_option,sentiment_method
수면-이완,"속 끓는 당신, 힐링의 지혜 화병 치유의 첫걸음","특히, '뜸 치료'는 스트레스로 인해 뭉친 근육을 이완시키고, 소화 기능을 개선하는 데 효과적입니다. 따뜻한 기운이 몸속 깊이 스며들어, 마음까지 편안하게 만들어줍니다. 마음 챙김의 중요성 감정을 건강하게... ",brightb1119님의 블로그,20260225,https://blog.naver.com/brightb1119/224194769296,2,"전반적으로 강한 긍정 경향이 나타나며, 수면·이완(담요/수면 보조/힐링 관련) 제품에 대한 평가에서 기능과 활용도에 대한 만족도가 높습니다.",수면 이완 담요 수면개선 힐링 편안 포근한 담요,ko,2025-01-15,naver_blog,date,rule_based_custom_korean_lexicon_v1
수면-이완,손 마사지로 다스리는 감정의 파도 호흡과 함께하는 힐링,"섬섬옥수, 손 마사지로 다스리는 감정의 파도 호흡과 함께하는 힐링 지친 하루, 간단한 손 마사지로... 손 마사지는 혈액순환을 촉진하고 뭉친 근육을 이완시켜 피로 해소에 탁월하며, 스트레스 완화에도 도움을... ",괌카이삭,20260225,https://blog.naver.com/m46348b2/224194818869,3,"전반적으로 강한 긍정 경향이 나타나며, 수면·이완(담요/수면 보조/힐링 관련) 제품에 대한 평가에서 기능과 활용도에 대한 만족도가 높습니다.",수면 이완 담요 수면개선 힐링 편안 포근한 담요,ko,2025-01-15,naver_blog,date,rule_based_custom_korean_lexicon_v1
수면-이완,향긋한 아로마와 함께 마사지 꿀팁으로 힐링하는 하루,향긋한 아로마와 함께 마사지 꿀팁으로 힐링하는 하루 향기로운 공간 만들기: 마사지 전 간단 준비 팁... 편안한 분위기가 마사지 효과를 극대화해 줄 거예요. 마사지 오일을 살짝 데워두면 더욱 포근한 느낌을... ,ogerq님의 블로그,20260225,https://blog.naver.com/ogerq/224194823979,2,"전반적으로 강한 긍정 경향이 나타나며, 수면·이완(담요/수면 보조/힐링 관련) 제품에 대한 평가에서 기능과 활용도에 대한 만족도가 높습니다.",수면 이완 담요 수면개선 힐링 편안 포근한 담요,ko,2025-01-15,naver_blog,date,rule_based_custom_korean_lexicon_v1
수면-이완,"지친 하루, 두피 마사지로 뇌에게 휴식을!","부드러운 면 소재 옷을 입거나, 담요를 덮는 것도 좋은 방법이에요. 특히, 발목과 목을 따뜻하게 유지하는 것이 중요해요. 양말을 신고, 목도리나 스카프를 활용해보세요. 따뜻함 속에서 더욱 편안하게 마사지를... ",PICK 파인애플,20260225,https://blog.naver.com/gvcdb192/224194838785,0,"긍정과 부정이 혼재하거나 뚜렷한 감정 표현이 적어, 수면·이완(담요/수면 보조/힐링 관련) 제품에 대한 평가에 대해 중립에 가까운 평가가 많습니다.",수면 이완 담요 수면개선 힐링 편안 포근한 담요,ko,2025-01-15,naver_blog,date,rule_based_custom_korean_lexicon_v1
수면-이완,"일상 속 작은 쉼표, 팔 근육 마사지 효능","몸이 이완되면서 느끼는 편안함 때문일 수도 있습니다. '마사지 중' 일어나는 감정 변화에 당황하지... 규칙적인 수면, 균형 잡힌 식단, 꾸준한 스트레칭은 마사지 효과를 더욱 높여줍니다. 또한, 평소 바른 자세를... ",kfww10dq님의 블로그,20260225,https://blog.naver.com/kfww10dq/224194844801,0,"긍정과 부정이 혼재하거나 뚜렷한 감정 표현이 적어, 수면·이완(담요/수면 보조/힐링 관련) 제품에 대한 평가에 대해 중립에 가까운 평가가 많습니다.",수면 이완 담요 수면개선 힐링 편안 포근한 담요,ko,2025-01-15,naver_blog,date,rule_based_custom_korean_lexicon_v1
수면-이완,"이탈리아 이메텍 풋워머, 따뜻함으로 힐링하세요!",부드러운 소재와 인체공학적인 디자인으로 편안함까지 선사하죠. 마치 포근한 담요를 덮은 듯한... 난방 #안전 풋워머 #편안한 쉼 #혈액순환 개선 #프리미엄 풋워머 #할인 상품 #따뜻한 겨울 #가성비 풋워머,evplorg님의 블로그,20260225,https://blog.naver.com/evplorg/224194893001,2,"전반적으로 강한 긍정 경향이 나타나며, 수면·이완(담요/수면 보조/힐링 관련) 제품에 대한 평가에서 기능과 활용도에 대한 만족도가 높습니다.",수면 이완 담요 수면개선 힐링 편안 포근한 담요,ko,2025-01-15,naver_blog,date,rule_based_custom_korean_lexicon_v1
수면-이완,"일상 속 활력, 마사지 효과 극대화 꿀팁 공간 준비부터 호흡까지","깊고 편안한 호흡은 근육 이완을 돕고, 마사지 효과를 극대화합니다. 숨을 깊게 들이쉬고 천천히... 꾸준한 마사지는 혈액순환 개선에 효과적입니다. 마사지를 통해 손발 저림의 고통에서 벗어나 보세요. 림프... ",센 출퇴근,20260225,https://blog.naver.com/wlq8mt/224194893719,1,"대체로 약한 긍정 경향이 나타나며, 수면·이완(담요/수면 보조/힐링 관련) 제품에 대한 평가에서 기본적인 효용과 실용성이 인정됩니다.",수면 이완 담요 수면개선 힐링 편안 포근한 담요,ko,2025-01-15,naver_blog,date,rule_based_custom_korean_lexicon_v1
수면-이완,"캐모마일 효능 5가지와 부작용 먹는방법, 캐모마일차 카페인... ","은은한 향 때문에 힐링 차로 유명하지만 실제로 어떤 효능이 있는지, 카페인은 들어 있는지, 매일... 캐모마일 효능 5가지 1) 수면의 질 개선에 도움을 줄 수 있습니다 아피제닌 성분이 신경을 안정시키는 작용을... ",하루건강쉐어,20260225,https://blog.naver.com/lees_k/224194921658,3,"전반적으로 강한 긍정 경향이 나타나며, 수면·이완(담요/수면 보조/힐링 관련) 제품에 대한 평가에서 기능과 활용도에 대한 만족도가 높습니다.",수면 이완 담요 수면개선 힐링 편안 포근한 담요,ko,2025-01-15,naver_blog,date,rule_based_custom_korean_lexicon_v1
수면-이완,"업무 중 힐링, 5분 마사지로 코까지 뻥 뚫리는 비법?","업무 중 힐링, 5분 마사지로 코까지 뻥 뚫리는 비법? 초간단! 직장인을 위한 5분 마사지 비법 업무... 혈액순환을 개선하여 비염 증상 완화에 도움을 줄 수 있습니다. 마사지로 코 막힘 없이 편안한 숨을 쉬세요!... ",q96vu6ie님의 블로그,20260225,https://blog.naver.com/q96vu6ie/224195001158,4,"전반적으로 강한 긍정 경향이 나타나며, 수면·이완(담요/수면 보조/힐링 관련) 제품에 대한 평가에서 기능과 활용도에 대한 만족도가 높습니다.",수면 이완 담요 수면개선 힐링 편안 포근한 담요,ko,2025-01-15,naver_blog,date,rule_based_custom_korean_lexicon_v1
수면-이완,시흥 마사지 유형별 전문성 확인과 건강 유지 위한 실질적 지침,"최근 들어 시흥 마사지 샵들은 단순한 안마를 넘어 테라피적인 요소와 힐링 요소를 결합한 형태로... 신체적 이완은 곧 정신적 이완으로 이어지며, 이는 업무 집중도 향상과 수면의 질 개선에 직접적으로... ",루이맘의 육아 스토리,20260225,https://blog.naver.com/modern1016/224195002372,2,"전반적으로 강한 긍정 경향이 나타나며, 수면·이완(담요/수면 보조/힐링 관련) 제품에 대한 평가에서 기능과 활용도에 대한 만족도가 높습니다.",수면 이완 담요 수면개선 힐링 편안 포근한 담요,ko,2025-01-15,naver_blog,date,rule_based_custom_korean_lexicon_v1
수면-이완,도곡동마사지 참몸수기테라피 현명한 선택으로 삶의 활력... ,"또한, 평소 생활 습관 개선을 병행한다면 마사지의 효과는 더욱 오래 지속될 것입니다. 올바른 자세 유지, 적절한 스트레칭, 충분한 수면 확보 등은 전문적인 관리의 효과를 일상 속에서 공고히 하는 기반이... ",skatlr21님의 블로그,20260225,https://blog.naver.com/skatlr21/224195076886,1,"대체로 약한 긍정 경향이 나타나며, 수면·이완(담요/수면 보조/힐링 관련) 제품에 대한 평가에서 기본적인 효용과 실용성이 인정됩니다.",수면 이완 담요 수면개선 힐링 편안 포근한 담요,ko,2025-01-15,naver_blog,date,rule_based_custom_korean_lexicon_v1
수면-이완,"운동 후, 지친 몸을 위한 리셋 전략","운동 다음에 포근한 물로 샤워하거나 목욕을 하면, 몸의 긴장이 풀리고 피로가 훨씬 가벼워진다. 온수로 몸을 따마음하게 데우측 혈액 순환이 개선되어 근육이 이완되고, 피로 복구에 중한 도움이 된다. 또한... ",산들바람,20260225,https://blog.naver.com/okwcompany10/224195097904,3,"전반적으로 강한 긍정 경향이 나타나며, 수면·이완(담요/수면 보조/힐링 관련) 제품에 대한 평가에서 기능과 활용도에 대한 만족도가 높습니다.",수면 이완 담요 수면개선 힐링 편안 포근한 담요,ko,2025-01-15,naver_blog,date,rule_based_custom_korean_lexicon_v1
수면-이완,실생활에 맞춘 Zebeer 겨울극세사 보온 부드러운 워싱 누빔... ,고정밴딩으로 움직임 걱정 없이 편안한 수면을 보장하는 이 제품이 새로운 겨울 필수템이 될 거예요.... 부드럽고 포근한 극세사 소재가 차가운 밤에도 따뜻함을 유지시켜주며 가볍고 촉감이 좋아 잠들기... ,sinkerj님의 블로그,20260225,https://blog.naver.com/sinkerj/224195113667,0,"긍정과 부정이 혼재하거나 뚜렷한 감정 표현이 적어, 수면·이완(담요/수면 보조/힐링 관련) 제품에 대한 평가에 대해 중립에 가까운 평가가 많습니다.",수면 이완 담요 수면개선 힐링 편안 포근한 담요,ko,2025-01-15,naver_blog,date,rule_based_custom_korean_lexicon_v1
수면-이완,서귀포마사지 유형별 특징 이해와 라움아로마 이용 성공을 위한... ,"근육 이완 상태를 유지하는 데 도움을 줍니다. 이러한 체계적인 접근 방식을 따른다면, 서귀포에서의 시간이 더욱 편안하고 재충전되는 시간으로 기억될 수 있을 것입니다. 서귀포마사지 이용이 가져다주는... ",khjh0620님의블로그,20260225,https://blog.naver.com/khjh0620/224195140000,1,"대체로 약한 긍정 경향이 나타나며, 수면·이완(담요/수면 보조/힐링 관련) 제품에 대한 평가에서 기본적인 효용과 실용성이 인정됩니다.",수면 이완 담요 수면개선 힐링 편안 포근한 담요,ko,2025-01-15,naver_blog,date,rule_based_custom_korean_lexicon_v1
수면-이완,제주도마사지 예약 이용 방법 유형별 특징별 현명한 선택법,림프 드레나지: 붓기 개선을 원하거나 부종이 있는 경우에 효과적. 마사지 강도가 약한 편이다. 아로마 마사지: 향과 함께 심리적 안정과 이완을 원할 때 선택. 향에 민감하면 사전 확인 필수. 각 코스별 추천... ,sh3775,20260226,https://blog.naver.com/sh3775/224196647205,2,"전반적으로 강한 긍정 경향이 나타나며, 수면·이완(담요/수면 보조/힐링 관련) 제품에 대한 평가에서 기능과 활용도에 대한 만족도가 높습니다.",수면 이완 담요 수면개선 힐링 편안 포근한 담요,ko,2025-01-15,naver_blog,date,rule_based_custom_korean_lexicon_v1
수면-이완,반복되는 목통증치료 근본 원인부터 잡아야 하는 이유,"그래서 더 좋은 매트리스, 더 포근한 이불, 더 조용한 환경을 찾게 되는 것일 수도 있습니다. 잠은... 원인을 개선하는 것, 그리고 재발 가능성을 낮추고 일상에서 편안함을 유지할 수 있도록 돕는 것. 지긋지긋한... ",로코모 재활의학과의원,20260226,https://blog.naver.com/locomo_med/224196668808,1,"대체로 약한 긍정 경향이 나타나며, 수면·이완(담요/수면 보조/힐링 관련) 제품에 대한 평가에서 기본적인 효용과 실용성이 인정됩니다.",수면 이완 담요 수면개선 힐링 편안 포근한 담요,ko,2025-01-15,naver_blog,date,rule_based_custom_korean_lexicon_v1
수면-이완,"드웰러 탄소매트, 따스함과 건강을 동시에 챙겨봐요!","이는 몸속 깊숙이 온기를 전달해주어 혈액순환 개선에 도움을 줄 수 있고, 뭉친 근육을 이완시키는 데도... 쾌적한 수면 환경을 만들어준답니다. 안정적인 온열 난방은 물론, 편안한 휴식까지 책임지는 드웰러... ",iivsos님의 블로그,20260226,https://blog.naver.com/iivsos/224196673969,2,"전반적으로 강한 긍정 경향이 나타나며, 수면·이완(담요/수면 보조/힐링 관련) 제품에 대한 평가에서 기능과 활용도에 대한 만족도가 높습니다.",수면 이완 담요 수면개선 힐링 편안 포근한 담요,ko,2025-01-15,naver_blog,date,rule_based_custom_korean_lexicon_v1
수면-이완,피로마그네슘 활용법과 스트레스 완화 건강 관리 이야기,피로마그네슘의 기본 역할 이해하기 피로마그네슘은 체내 에너지 생산과 근육 이완에 필수적이에요.... 숙면 개선 위한 피로마그네슘 활용법 수면 장애 때문에 고생할 때가 있었는데 잠자기 전에 따뜻한 우유나... ,로그인일상,20260226,https://blog.naver.com/ofyznkm/224196778243,1,"대체로 약한 긍정 경향이 나타나며, 수면·이완(담요/수면 보조/힐링 관련) 제품에 대한 평가에서 기본적인 효용과 실용성이 인정됩니다.",수면 이완 담요 수면개선 힐링 편안 포근한 담요,ko,2025-01-15,naver_blog,date,rule_based_custom_korean_lexicon_v1
수면-이완,슈퍼싱글 매트리스 사이즈 리얼 후기 공간 활용 꿀팁,벌리거나 편안하게 호흡하며 몸을 이완시키려면 생각보다 많은 좌우 여백이 필요합니다. 싱글 사이즈... 풍성하고 포근한 느낌을 제대로 연출할 수 있습니다. 저는 계절별로 두께감과 재질이 다른 150x210cm... ,봄이야,20260226,https://blog.naver.com/ufallsitez53/224196812204,-1,"대체로 약한 부정 경향이 나타나며, 수면·이완(담요/수면 보조/힐링 관련) 제품에 대한 평가에서 일부 기능·편의성·성능에 대한 아쉬움이 보고됩니다.",수면 이완 담요 수면개선 힐링 편안 포근한 담요,ko,2025-01-15,naver_blog,date,rule_based_custom_korean_lexicon_v1
수면-이완,꿀잠을 부르는 강아지 수면 루틴,강아지가 편안하게 느낄 수 있는 수면 공간을 마련해 주는 것이 중요합니다 조용하고 어두운 곳에 강아지의 침대나 포근한 담요를 두어 안정감을 줄 수 있습니다 이때 침대는 강아지의 크기와 취향에 맞춰... ,용의 수호자,20260226,https://blog.naver.com/zohna/224192894558,0,"긍정과 부정이 혼재하거나 뚜렷한 감정 표현이 적어, 수면·이완(담요/수면 보조/힐링 관련) 제품에 대한 평가에 대해 중립에 가까운 평가가 많습니다.",수면 이완 담요 수면개선 힐링 편안 포근한 담요,ko,2025-01-15,naver_blog,date,rule_based_custom_korean_lexicon_v1
수면-이완,"숙면에좋은차, 이제 헤매지 마세요! 5가지 핵심 비교 & 나에게... ","캐모마일: 은은한 사과 향이 특징이며, 신경 안정 및 이완 효과가 뛰어납니다. 불면증 완화에 도움을 줄... 감태차: 감태에 함유된 '디엑콜' 성분이 수면의 질을 개선하는 데 도움을 줄 수 있습니다. 최근 연구... ",생활화학꿀팁님의 블로그,20260226,https://blog.naver.com/life-living/224187169069,3,"전반적으로 강한 긍정 경향이 나타나며, 수면·이완(담요/수면 보조/힐링 관련) 제품에 대한 평가에서 기능과 활용도에 대한 만족도가 높습니다.",수면 이완 담요 수면개선 힐링 편안 포근한 담요,ko,2025-01-15,naver_blog,date,rule_based_custom_korean_lexicon_v1
수면-이완,[상품리뷰] 숙면을 부르는 숲속향 뉴브 Pine cone... ,cook의 포근한 플로럴 무드는 서로 다른 휴식의 결을 보여줍니다 시향 단계부터 이미 마음이... 숲속향 #수면루틴 #꿀잠템 #힐링향기 #아로마테라피 #베개미스트 #감성선물 #자기전루틴 #편안한밤 #우디향... ,오늘도 맛블리,20260226,https://blog.naver.com/goqud83/224196964636,1,"대체로 약한 긍정 경향이 나타나며, 수면·이완(담요/수면 보조/힐링 관련) 제품에 대한 평가에서 기본적인 효용과 실용성이 인정됩니다.",수면 이완 담요 수면개선 힐링 편안 포근한 담요,ko,2025-01-15,naver_blog,date,rule_based_custom_korean_lexicon_v1
수면-이완,빗소리의 심리적 효과 안정감을 주는 소리의 힘,"소리가 편안함을 주기 때문입니다 자연의 소리는 뇌의 알파파를 증가시켜 이완 상태를 유도하고, 수면... 상태를 개선하는 데 기여합니다 자연과의 연결을 느끼게 하고, 감정적인 회상을 자극하며, 깊은 이완을... ",unlikenr님의 블로그,20260226,https://blog.naver.com/unlikenr/224187395354,1,"대체로 약한 긍정 경향이 나타나며, 수면·이완(담요/수면 보조/힐링 관련) 제품에 대한 평가에서 기본적인 효용과 실용성이 인정됩니다.",수면 이완 담요 수면개선 힐링 편안 포근한 담요,ko,2025-01-15,naver_blog,date,rule_based_custom_korean_lexicon_v1
수면-이완,한가인 브라이언 항균 물티슈 주름제거 스프레이 살균 소독... ,'크리스프 린넨(Crisp Linen)' 향은 갓 세탁해 햇볕에 잘 말린 듯한 깨끗하고 포근한 느낌을 주어 옷을 입는... 특히 수면 모드에서는 더욱 고요하게 작동하여 편안한 숙면을 방해하지 않습니다. 속삭임처럼 조용한... ,스탠딩굿즈,20260226,https://blog.naver.com/lzheng/224197105897,0,"긍정과 부정이 혼재하거나 뚜렷한 감정 표현이 적어, 수면·이완(담요/수면 보조/힐링 관련) 제품에 대한 평가에 대해 중립에 가까운 평가가 많습니다.",수면 이완 담요 수면개선 힐링 편안 포근한 담요,ko,2025-01-15,naver_blog,date,rule_based_custom_korean_lexicon_v1
수면-이완,발에서 시작되는 단전호흡과 용천혈 자극으로 완성하는... ,"이완하게 됩니다. 이는 과항진된 교감신경을 진정시키고, 어깨와 목의 긴장을 풀어주어 호흡을 편안... 안정·수면 개선·피로 감소에 도움 된다는 연구 있음 (예: 족욕 + 지압 연구에서 혈압 하강 효과 관찰)... ",Ss 보험닥터 김성한 01058002008,20260226,https://blog.naver.com/mailer-/224197126653,2,"전반적으로 강한 긍정 경향이 나타나며, 수면·이완(담요/수면 보조/힐링 관련) 제품에 대한 평가에서 기능과 활용도에 대한 만족도가 높습니다.",수면 이완 담요 수면개선 힐링 편안 포근한 담요,ko,2025-01-15,naver_blog,date,rule_based_custom_korean_lexicon_v1
수면-이완,인하대역 요가 빈야사·아쉬탕가·하타·척추리셋까지 내 몸에... ,아쉬탕가 힐링 릴렉스 척추 리셋 강도 중간 강함 약함 매우 약함 약~중간 목적 체력 + 유연성 근력 + 수련 통증 완화 + 회복 이완 + 스트레스 해소 척추 교정 + 자세 개선 초보자 △ △ ✅ ✅ ✅  마치며 — 내 몸에... ,Vamos Wellness Club,20260226,https://blog.naver.com/australiapilates_/224196591830,2,"전반적으로 강한 긍정 경향이 나타나며, 수면·이완(담요/수면 보조/힐링 관련) 제품에 대한 평가에서 기능과 활용도에 대한 만족도가 높습니다.",수면 이완 담요 수면개선 힐링 편안 포근한 담요,ko,2025-01-15,naver_blog,date,rule_based_custom_korean_lexicon_v1
수면-이완,전주송천동신경과 수면 불안 무기력감이 지속될 때 고려할... ,"본론 수면 개선을 위한 효과적인 접근법** 수면의 질을 높이는 것은 많은 정신적, 신체적 문제를... 어두운 조명과 편안한 침구는 수면의 질을 높이는 데 큰 도움이 돼요. 이러한 작은 변화들이 모여서 꿀잠을... ",✅20년 간 전통 한의학을 연구한 소라한의원✅,20260226,https://blog.naver.com/primitive775/224197269168,1,"대체로 약한 긍정 경향이 나타나며, 수면·이완(담요/수면 보조/힐링 관련) 제품에 대한 평가에서 기본적인 효용과 실용성이 인정됩니다.",수면 이완 담요 수면개선 힐링 편안 포근한 담요,ko,2025-01-15,naver_blog,date,rule_based_custom_korean_lexicon_v1
수면-이완,신림역두피관리 아늑에스테틱&헤드스파 힐링되는 두피관리... ,"두피 이완을 통해 스트레스 완화, 수면 질 개선, 문제성 두피 관리와 스케일링을 돕는 프로그램이다. 싱잉볼과 이어 테라피를 결합해 소리와 진동, 아로마까지 다양하게 어우러지는 힐링 케어를 제공하는 것이... ","응, 하고 싶은 거 다 해",20260226,https://blog.naver.com/lookerr/224197313099,2,"전반적으로 강한 긍정 경향이 나타나며, 수면·이완(담요/수면 보조/힐링 관련) 제품에 대한 평가에서 기능과 활용도에 대한 만족도가 높습니다.",수면 이완 담요 수면개선 힐링 편안 포근한 담요,ko,2025-01-15,naver_blog,date,rule_based_custom_korean_lexicon_v1
수면-이완,신림두피관리 아늑 에스테틱 & 헤드스파 힐링스파에서 진짜... ,2층에 도착하자 이름처럼 포근한 분위기가 반겨주었어요. 아늑 에스테틱 & 헤드스파는 신대방에서 확장... 공간에서 힐링스파를 경험하고 싶은 분들 · 나의 두피를 직접 눈으로 보고 즉각적인 개선을 원하시는... ,사랑스러운 연재네,20260226,https://blog.naver.com/jangseungyun/224197314126,3,"전반적으로 강한 긍정 경향이 나타나며, 수면·이완(담요/수면 보조/힐링 관련) 제품에 대한 평가에서 기능과 활용도에 대한 만족도가 높습니다.",수면 이완 담요 수면개선 힐링 편안 포근한 담요,ko,2025-01-15,naver_blog,date,rule_based_custom_korean_lexicon_v1
수면-이완,♨️ 몸도 마음도 사르르 녹는 따뜻한 족욕 데이트 ♨️,"부드럽게 이완되고, 밤에 잠도 훨씬 푹 주무실 수 있게 도와준답니다. 어르신 무릎 위에는 포근한 빨간색 체크무늬 담요까지 덮어드려서 따뜻한 온기가 밖으로 새어 나가지 않게 꼼꼼히 신경을 써드렸어요.... ",사랑과 행복의 김포 벧엘 요양원,20260226,https://blog.naver.com/0191bethel/224197315170,0,"긍정과 부정이 혼재하거나 뚜렷한 감정 표현이 적어, 수면·이완(담요/수면 보조/힐링 관련) 제품에 대한 평가에 대해 중립에 가까운 평가가 많습니다.",수면 이완 담요 수면개선 힐링 편안 포근한 담요,ko,2025-01-15,naver_blog,date,rule_based_custom_korean_lexicon_v1
수면-이완,중랑구 수기마사지 추천top기준 알려드립니다/실패없이... ,분 ✔ 수면의 질 개선을 원하는 분 특히 주 1~2회가 아닌 2~4주 주기 관리가 컨디션 유지에 도움이... 중랑구힐링마사지#중랑구관리샵#중랑구마사지샵 #중랑구체형관리#중랑구근육이완#중랑구어깨마사지... ,더 하노이풋앤바디 상봉역점,20260226,https://blog.naver.com/hanoi0728/224197035970,4,"전반적으로 강한 긍정 경향이 나타나며, 수면·이완(담요/수면 보조/힐링 관련) 제품에 대한 평가에서 기능과 활용도에 대한 만족도가 높습니다.",수면 이완 담요 수면개선 힐링 편안 포근한 담요,ko,2025-01-15,naver_blog,date,rule_based_custom_korean_lexicon_v1
수면-이완,서귀포마사지 유형별 특징 분석으로 여행자 맞춤형 컨디션 회복... ,"제주 남쪽 도시의 힐링 해법, 서귀포마사지 이해하기 아름다운 자연환경으로 수많은 방문객을... 근육의 긴장이 해소되면 수면의 질이 개선되고, 이는 곧 다음 날의 활동 에너지로 직결됩니다. 특히 제주 여행 중... ",건강한 몸으로 살기,20260226,https://blog.naver.com/hhhhhdd/224196589422,2,"전반적으로 강한 긍정 경향이 나타나며, 수면·이완(담요/수면 보조/힐링 관련) 제품에 대한 평가에서 기능과 활용도에 대한 만족도가 높습니다.",수면 이완 담요 수면개선 힐링 편안 포근한 담요,ko,2025-01-15,naver_blog,date,rule_based_custom_korean_lexicon_v1
수면-이완,서귀포마사지 유형별 특징 이해와 여행자 힐링 경험을 위한... ,"편안하고 위생적인 환경은 심신 이완에 결정적인 영향을 미칩니다. 조명, 음악, 실내 온도 등 세심한... 깊은 이완 상태에 도달하게 되면 수면의 질이 향상되어, 제주에서의 하루를 더욱 개운하게 마무리할 수... ",너와 함께한 시간 모두 눈 부셨다,20260226,https://blog.naver.com/story38317/224196745998,1,"대체로 약한 긍정 경향이 나타나며, 수면·이완(담요/수면 보조/힐링 관련) 제품에 대한 평가에서 기본적인 효용과 실용성이 인정됩니다.",수면 이완 담요 수면개선 힐링 편안 포근한 담요,ko,2025-01-15,naver_blog,date,rule_based_custom_korean_lexicon_v1
