category,title,description,blogger,date,link,sentiment_score,sentiment_interpretation,search_query,search_lang,collected_at,platform,sort_option,sentiment_method
수면-이완,속초 마사지 유형별 특징 이해하고 여행의 질을 높이는 최적의... ,"속초 마사지는 단순한 통증 해소를 넘어, 여행의 질을 한 단계 끌어올리는 필수적인 힐링 과정으로... 혈액 순환이 개선되면서 몸 전체에 활력이 돌고, 수면의 질이 향상되어 다음 날의 관광 활동에 필요한... ",나만의 세상으로....,20260309,https://blog.naver.com/wkddmsdud83/224209674553,2,"전반적으로 강한 긍정 경향이 나타나며, 수면·이완(담요/수면 보조/힐링 관련) 제품에 대한 평가에서 기능과 활용도에 대한 만족도가 높습니다.",수면 이완 담요 수면개선 힐링 편안 포근한 담요,ko,2025-01-15,naver_blog,date,rule_based_custom_korean_lexicon_v1
수면-이완,"디지털 해독, 스크린 없이 즐기는 삶","디지털 해독이 건강에 미치는 긍정적 영향 정신 건강 개선 불안, 우울, 스트레스 완화에 도움 되며, 마음이 안정되고 삶의 만족도가 올라갑니다. 수면 질 향상 블루라이트 차단과 심신 이완으로 깊고 편안한... ",라이프스타일 연구소,20260309,https://blog.naver.com/tadiet/224209775686,3,"전반적으로 강한 긍정 경향이 나타나며, 수면·이완(담요/수면 보조/힐링 관련) 제품에 대한 평가에서 기능과 활용도에 대한 만족도가 높습니다.",수면 이완 담요 수면개선 힐링 편안 포근한 담요,ko,2025-01-15,naver_blog,date,rule_based_custom_korean_lexicon_v1
수면-이완,"한국인 10명 중 7명 수면 불만족, 내 수면 건강 점수 확인법... ","한국인 10명 중 7명 수면 불만족! 내 수면 건강 점수는? 안녕하세요! 2026년 3월, 포근한 봄기운이 완연한... 나만의 '수면 의식' 만들기 ♀️ 잠들기 1시간 전부터는 몸과 마음을 편안하게 이완시키는 나만의 루틴을... ",꽃보다일순,20260309,https://blog.naver.com/kis3367/224209657729,2,"전반적으로 강한 긍정 경향이 나타나며, 수면·이완(담요/수면 보조/힐링 관련) 제품에 대한 평가에서 기능과 활용도에 대한 만족도가 높습니다.",수면 이완 담요 수면개선 힐링 편안 포근한 담요,ko,2025-01-15,naver_blog,date,rule_based_custom_korean_lexicon_v1
수면-이완,고양이 잠꼬대 울음 쩝쩝 소리 잠자는 자세 어떤 기분이었을까요,"이를 '유아기 퇴행' 현상이라고도 하는데, 고양이가 성묘가 되어서도 집사나 포근한 담요에 꾹꾹이를... 이때 가장 깊은 잠인 REM 수면에 빠지기 쉽고, 몸이 완전히 이완되어 뇌의 활동(꿈)이 밖으로 더 잘... ",요모조모 뭉티티세상,20260309,https://blog.naver.com/hahehe-/224209823726,0,"긍정과 부정이 혼재하거나 뚜렷한 감정 표현이 적어, 수면·이완(담요/수면 보조/힐링 관련) 제품에 대한 평가에 대해 중립에 가까운 평가가 많습니다.",수면 이완 담요 수면개선 힐링 편안 포근한 담요,ko,2025-01-15,naver_blog,date,rule_based_custom_korean_lexicon_v1
수면-이완,편안함을 주는 포근한 향기의 힘,편안함을 주는 포근한 향기의 힘 편안함을 주는 포근한 향기의 힘은 우리의 감정과 기억에 깊은 영향을... 깊은 이완과 편안함을 가져다줍니다 라벤더의 부드럽고 달콤한 향은 불안을 줄이고 수면의 질을 개선하... ,closet3rw님의 블로그,20260309,https://blog.naver.com/closet3rw/224202583662,1,"대체로 약한 긍정 경향이 나타나며, 수면·이완(담요/수면 보조/힐링 관련) 제품에 대한 평가에서 기본적인 효용과 실용성이 인정됩니다.",수면 이완 담요 수면개선 힐링 편안 포근한 담요,ko,2025-01-15,naver_blog,date,rule_based_custom_korean_lexicon_v1
수면-이완,"오아 온열찜질기W, 편안함을 선사하는 전신 찜질팩","찜질 담요 기능을 갖추고 있어, 일상에서의 피로와 스트레스를 효과적으로 완화하는 데 도움을 줍니다. 이 제품의 가장 큰 특징은 다양한 온열 기능입니다. 온열 치료는 혈액 순환을 개선하고, 근육 이완을... ",다정한 친구와,20260309,https://blog.naver.com/mxhmvrta0946c2/224209900033,2,"전반적으로 강한 긍정 경향이 나타나며, 수면·이완(담요/수면 보조/힐링 관련) 제품에 대한 평가에서 기능과 활용도에 대한 만족도가 높습니다.",수면 이완 담요 수면개선 힐링 편안 포근한 담요,ko,2025-01-15,naver_blog,date,rule_based_custom_korean_lexicon_v1
수면-이완,"고요한 숨결, 마곡의 평온을 깨닫다","마곡마사지의 배려 덕분에 몸과 마음 모두 편안하게 힐링할 수 있었습니다. 일상에 활력을 더하다... 규칙적인 마사지는 스트레스 관리 능력을 향상시키고, 수면의 질을 개선하는 데 긍정적인 영향을 미친다고... ",힙스터,20260309,https://blog.naver.com/3rayplok/224210049040,2,"전반적으로 강한 긍정 경향이 나타나며, 수면·이완(담요/수면 보조/힐링 관련) 제품에 대한 평가에서 기능과 활용도에 대한 만족도가 높습니다.",수면 이완 담요 수면개선 힐링 편안 포근한 담요,ko,2025-01-15,naver_blog,date,rule_based_custom_korean_lexicon_v1
수면-이완,"[매곡 여성 PT]  몸이 가벼워지는 습관, 반신욕의 효능","이완되고 긴장이 풀립니다. 이 과정에서 몸이 편안해지면서 ✔ 스트레스 완화 ✔ 수면의 질 개선... 하루 15~20분, 몸을 위한 작은 힐링 시간을 만들어보세요.  다이어트/ 체력증진/ 체형교정/재활 교정운동 보디... ",여성전문 PT샵 MK짐 3호점,20260309,https://blog.naver.com/lovechacha78/224210491510,2,"전반적으로 강한 긍정 경향이 나타나며, 수면·이완(담요/수면 보조/힐링 관련) 제품에 대한 평가에서 기능과 활용도에 대한 만족도가 높습니다.",수면 이완 담요 수면개선 힐링 편안 포근한 담요,ko,2025-01-15,naver_blog,date,rule_based_custom_korean_lexicon_v1
수면-이완,"포근한 담요, 마곡의 나른함을 더하다",독립된 룸에서 편안하게 관리받으며 따뜻한 물에 발을 담그는 족욕 시간은 그 자체로 훌륭한 힐링... 따뜻한 돌의 온기가 뭉친 근육을 부드럽게 이완시켜주고 혈액순환을 촉진시켜 몸 속 깊은 곳까지 따뜻하게... ,cv3wg0a8님의 블로그,20260309,https://blog.naver.com/cv3wg0a8/224210199438,1,"대체로 약한 긍정 경향이 나타나며, 수면·이완(담요/수면 보조/힐링 관련) 제품에 대한 평가에서 기본적인 효용과 실용성이 인정됩니다.",수면 이완 담요 수면개선 힐링 편안 포근한 담요,ko,2025-01-15,naver_blog,date,rule_based_custom_korean_lexicon_v1
수면-이완,원주 미타임 &피부바디 바디테라피 받은후기,"편안하게 받을수있었어요 저는 처음 으로 스톤관리를 받아보았는데 스톤관리는 따뜻한 현무암돌로 근육이완, 혈액순환을 촉진시키는 온열테라피입니다 통증,피로,스트레스, 심신안정,바디라인정리,숙면개선... ",꿍이와 마포리의 일상 :),20260309,https://blog.naver.com/sypain119/224210216036,1,"대체로 약한 긍정 경향이 나타나며, 수면·이완(담요/수면 보조/힐링 관련) 제품에 대한 평가에서 기본적인 효용과 실용성이 인정됩니다.",수면 이완 담요 수면개선 힐링 편안 포근한 담요,ko,2025-01-15,naver_blog,date,rule_based_custom_korean_lexicon_v1
수면-이완,일산서구 개별지도학원 완벽 추천 정리,"자연스럽게 이완된다. 눈 가리기 자체가 강력한 수면 유도제가 되지는 않지만, 짧은 시간의 눈 감음과... 짧은 휴식이 필요하다고 느낄 때, 끈으로 만든 간단한 찜질이나 포근한 담요의 한 쪽 끝을 눈 위에 가볍게... ",모든 조언을 모아,20260309,https://blog.naver.com/pantsa1/224210219260,1,"대체로 약한 긍정 경향이 나타나며, 수면·이완(담요/수면 보조/힐링 관련) 제품에 대한 평가에서 기본적인 효용과 실용성이 인정됩니다.",수면 이완 담요 수면개선 힐링 편안 포근한 담요,ko,2025-01-15,naver_blog,date,rule_based_custom_korean_lexicon_v1
수면-이완,"마사지, 일상 속 작은 쉼표 공간 조성부터 수면 효과까지!","마사지, 일상 속 작은 쉼표 공간 조성부터 수면 효과까지! 마사지 전, 아늑한 공간 조성으로 힐링... 특히, 따뜻한 오일을 사용한 마사지는 혈액 순환을 개선하고, 근육 이완을 촉진하여 더욱 편안한 수면을... ",찐넘나의 손으로 하,20260309,https://blog.naver.com/biogrpher94737/224210314892,2,"전반적으로 강한 긍정 경향이 나타나며, 수면·이완(담요/수면 보조/힐링 관련) 제품에 대한 평가에서 기능과 활용도에 대한 만족도가 높습니다.",수면 이완 담요 수면개선 힐링 편안 포근한 담요,ko,2025-01-15,naver_blog,date,rule_based_custom_korean_lexicon_v1
수면-이완,[구의역/필라테스] 나에게 맞는 요가 수업은?,"회복, 편안한 수면을 유도해 주는 힐링 수업입니다. 난이도: ☆☆☆☆★ 인 요가 근육을 과도하게 쓰지 않고, 한 자세를 오래 유지하며 몸의 깊은 결합조직(근막, 인대 등)을 이완시키는 정적인 요가입니다. 깊은... ",스카이필라테스&요가,20260309,https://blog.naver.com/iyoga486/224210384987,1,"대체로 약한 긍정 경향이 나타나며, 수면·이완(담요/수면 보조/힐링 관련) 제품에 대한 평가에서 기본적인 효용과 실용성이 인정됩니다.",수면 이완 담요 수면개선 힐링 편안 포근한 담요,ko,2025-01-15,naver_blog,date,rule_based_custom_korean_lexicon_v1
수면-이완,"군포 불면증 한의원, 임산부는 그냥 두어도 괜찮을까요?",수면 환경을 정리하고 몸이 편안해지는 루틴을 만드는 것도 도움이 된다고 했습니다. 본원에서는 이런 생활 관리가 불면증 개선의 기본이라고 설명했다고 했어요. 불면증이 계속되면 피로뿐 아니라 감정과... ,♥해아림 전국지점 안내,20260309,https://blog.naver.com/trudeab4551/224210419826,3,"전반적으로 강한 긍정 경향이 나타나며, 수면·이완(담요/수면 보조/힐링 관련) 제품에 대한 평가에서 기능과 활용도에 대한 만족도가 높습니다.",수면 이완 담요 수면개선 힐링 편안 포근한 담요,ko,2025-01-15,naver_blog,date,rule_based_custom_korean_lexicon_v1
수면-이완,신생아 침구 배치와 수면 루틴이 편안함에 미치는 영향,"작고 연약한 우리 아기가 밤새 편안하게 잘 자야만, 엄마 아빠도 한숨 돌릴 수 있으니까요. 그런데... 침구 배치와 수면 루틴이 서로 맞물릴 때 더욱 효과적입니다. 예컨대 따뜻하고 포근한 느낌을 주는 담요... ",고양이와 책상,20260309,https://blog.naver.com/choose10734/224210426287,0,"긍정과 부정이 혼재하거나 뚜렷한 감정 표현이 적어, 수면·이완(담요/수면 보조/힐링 관련) 제품에 대한 평가에 대해 중립에 가까운 평가가 많습니다.",수면 이완 담요 수면개선 힐링 편안 포근한 담요,ko,2025-01-15,naver_blog,date,rule_based_custom_korean_lexicon_v1
수면-이완,"활력 넘치는 일상, 마사지 효과 극대화 루틴!","발목부터 허벅지 방향으로 쓸어 올리듯 마사지하면 혈액 순환 개선에 도움이 됩니다. 특히 종아리... 마사지, 단순한 피로 해소를 넘어선 힐링 마사지는 단순히 뭉친 근육을 풀어주는 것을 넘어, 정신적인 안정과... ",햇살,20260309,https://blog.naver.com/hvwoa2064/224210460999,3,"전반적으로 강한 긍정 경향이 나타나며, 수면·이완(담요/수면 보조/힐링 관련) 제품에 대한 평가에서 기능과 활용도에 대한 만족도가 높습니다.",수면 이완 담요 수면개선 힐링 편안 포근한 담요,ko,2025-01-15,naver_blog,date,rule_based_custom_korean_lexicon_v1
수면-이완,"뭉친 엉덩이, 코끼리 다리, 마사지로 가뿐하게! 힐링 마사지 비법","힐링 마사지 비법 오래 앉아있는 당신을 위한 엉덩이 마사지, 활력 충전! 혹시 의자에 오래 앉아... 다리 마사지는 혈액순환을 촉진하여 다리의 피로를 풀어주고, 편안한 수면을 유도합니다. 부드럽게 주무르거나... ",편안한시선,20260309,https://blog.naver.com/7kqvvya4e/224210481462,2,"전반적으로 강한 긍정 경향이 나타나며, 수면·이완(담요/수면 보조/힐링 관련) 제품에 대한 평가에서 기능과 활용도에 대한 만족도가 높습니다.",수면 이완 담요 수면개선 힐링 편안 포근한 담요,ko,2025-01-15,naver_blog,date,rule_based_custom_korean_lexicon_v1
수면-이완,포항 북구 요가 | 예스의 싱잉볼과  함께하는 사바아사나,마음을 이완시키는 치유의 소리라고 불리기도 한답니다. 눈을 편안하게 감고 누운 상태에서 싱잉볼의... 도움 ✔️수면 질 개선 특히 요가 수업 후 싱잉볼을 들으면 몸이 이미 이완된 상태이기 때문에 더 깊은... ,몸과마음이 부드럽고 힘있게 포항예스요가,20260309,https://blog.naver.com/yes__yoga/224210109382,2,"전반적으로 강한 긍정 경향이 나타나며, 수면·이완(담요/수면 보조/힐링 관련) 제품에 대한 평가에서 기능과 활용도에 대한 만족도가 높습니다.",수면 이완 담요 수면개선 힐링 편안 포근한 담요,ko,2025-01-15,naver_blog,date,rule_based_custom_korean_lexicon_v1
수면-이완,서귀포 마사지 관리 방식별 특징 이해와 여행자 맞춤 회복을... ,"반대로, 전반적인 순환 개선과 심신의 안정을 원한다면 전신을 아우르는 부드러운 압력의 관리가 더... 걸친 이완을 유도하는 데 중점을 둡니다. 긴장된 근육을 강하게 압박하기보다는 전반적인 편안함을... ",s760531님의 블로그,20260309,https://blog.naver.com/s760531/224209627045,1,"대체로 약한 긍정 경향이 나타나며, 수면·이완(담요/수면 보조/힐링 관련) 제품에 대한 평가에서 기본적인 효용과 실용성이 인정됩니다.",수면 이완 담요 수면개선 힐링 편안 포근한 담요,ko,2025-01-15,naver_blog,date,rule_based_custom_korean_lexicon_v1
수면-이완,헤드스파 테라피 두피 활력 증진과 심신 안정 효과 현실적인... ,특히 의정부 지역에서 전문적인 케어를 찾는 분들에게 이 테라피는 새로운 차원의 휴식과 개선을... 전신적인 이완 반응을 유도합니다. 이는 마치 편안한 수면을 유도하는 것과 유사한 효과를 가져오며... ,희망바라깅 일상,20260309,https://blog.naver.com/jy_eh0701/224209803414,1,"대체로 약한 긍정 경향이 나타나며, 수면·이완(담요/수면 보조/힐링 관련) 제품에 대한 평가에서 기본적인 효용과 실용성이 인정됩니다.",수면 이완 담요 수면개선 힐링 편안 포근한 담요,ko,2025-01-15,naver_blog,date,rule_based_custom_korean_lexicon_v1
수면-이완,"포근한 담요처럼, 해운대 마사지 따스한 위로","그 따스함은 단순히 몸을 이완시키는 것을 넘어, 마음 깊은 곳까지 어루만져 주는 듯했습니다. 일상의... #해운대마사지 #부산마사지 #힐링 #아로마마사지 #해운대데이트 #편안함 #휴식 #힐링터치",데일리원스,20260309,https://blog.naver.com/improve44490/224209609473,2,"전반적으로 강한 긍정 경향이 나타나며, 수면·이완(담요/수면 보조/힐링 관련) 제품에 대한 평가에서 기능과 활용도에 대한 만족도가 높습니다.",수면 이완 담요 수면개선 힐링 편안 포근한 담요,ko,2025-01-15,naver_blog,date,rule_based_custom_korean_lexicon_v1
수면-이완,프롬비 닥터슬로우 FD225 전기찜질기로 따뜻하고 편안한 겨울... ,"프롬비 닥터슬로우 FD225 전기찜질기로 따뜻하고 편안한 겨울 맞이하기 겨울철 찬 바람, 온열 찜질기로... 발찜질기 #전기매트 #찜질매트 #온열매트 #겨울필수템 #건강용품 #피로회복 #수면개선 #난방비절감",월성동 삼성래미안 어린이집,20260309,https://blog.naver.com/xpgmdctzg/224209619057,1,"대체로 약한 긍정 경향이 나타나며, 수면·이완(담요/수면 보조/힐링 관련) 제품에 대한 평가에서 기본적인 효용과 실용성이 인정됩니다.",수면 이완 담요 수면개선 힐링 편안 포근한 담요,ko,2025-01-15,naver_blog,date,rule_based_custom_korean_lexicon_v1
수면-이완,"부드러운 담요, 마사지 후 찾아오는 나만의 휴식","마음도 이완되는 특별한 경험을 하게 되죠. 근육이 풀리면서 억눌렸던 감정들이 떠오르기도 합니다. 이때, 따뜻한 담요를 덮고 편안한 자세를 취하는 것이 중요해요. 몸의 감각에 집중하며 내면의 소리에 귀... ",아시안 하버,20260309,https://blog.naver.com/tzpsd4qy/224209310407,0,"긍정과 부정이 혼재하거나 뚜렷한 감정 표현이 적어, 수면·이완(담요/수면 보조/힐링 관련) 제품에 대한 평가에 대해 중립에 가까운 평가가 많습니다.",수면 이완 담요 수면개선 힐링 편안 포근한 담요,ko,2025-01-15,naver_blog,date,rule_based_custom_korean_lexicon_v1
수면-이완,"따뜻한 담요 속, 얼굴 마사지로 녹는 하루의 긴장","마사지 후 찾아오는 편안함, 나만의 작은 사치 마사지 전, 따뜻한 준비 퇴근 후, 부드러운 담요를 어깨에... 긴장 이완을 유도합니다. 긴장 해소를 위한 호흡 마사지 중에는 깊고 편안한 호흡을 유지하려고... ",nxhh09gn님의 블로그,20260309,https://blog.naver.com/nxhh09gn/224209316942,0,"긍정과 부정이 혼재하거나 뚜렷한 감정 표현이 적어, 수면·이완(담요/수면 보조/힐링 관련) 제품에 대한 평가에 대해 중립에 가까운 평가가 많습니다.",수면 이완 담요 수면개선 힐링 편안 포근한 담요,ko,2025-01-15,naver_blog,date,rule_based_custom_korean_lexicon_v1
수면-이완,"깊은 휴식을 위한 선택, 싱잉볼 수면테라피가 필요한 이유",하는 힐링 시간입니다. 그 방법 중 하나가 바로 싱잉볼 수면테라피입니다.  싱잉볼 수면테라피란?... 몸이 편안해지는 깊은 이완 상태를 경험할 수 있습니다. 2️⃣ 불면과 수면의 질 개선 잠들기 어려운 분들이... ,시니어 스타강사,20260309,https://blog.naver.com/pinkyjyj0922/224209326098,2,"전반적으로 강한 긍정 경향이 나타나며, 수면·이완(담요/수면 보조/힐링 관련) 제품에 대한 평가에서 기능과 활용도에 대한 만족도가 높습니다.",수면 이완 담요 수면개선 힐링 편안 포근한 담요,ko,2025-01-15,naver_blog,date,rule_based_custom_korean_lexicon_v1
수면-이완,"나른한 오후 햇살, 손등에 닿는 따스한 온기","따뜻함은 근육 이완을 돕고 혈액 순환을 촉진하여 마사지 효과를 극대화합니다. 체온 유지는 심리적인 안정감 또한 선사하며, 편안한 마사지 경험을 완성하는 중요한 요소입니다. '마사지 효과' 간단한 손... ",견생역전꽁이네,20260309,https://blog.naver.com/union86038/224209331948,0,"긍정과 부정이 혼재하거나 뚜렷한 감정 표현이 적어, 수면·이완(담요/수면 보조/힐링 관련) 제품에 대한 평가에 대해 중립에 가까운 평가가 많습니다.",수면 이완 담요 수면개선 힐링 편안 포근한 담요,ko,2025-01-15,naver_blog,date,rule_based_custom_korean_lexicon_v1
수면-이완,"포근한 담요, 등 뒤로 전해지는 섬세한 마사지","향기로운 오일은 긴장을 완화하고 편안한 수면을 돕습니다. 마사지 후 따뜻한 물로 마무리 마사지 후에는 따뜻한 물로 가볍게 샤워하는 것이 좋습니다. 이는 근육 이완을 돕고, 혈액 순환을 촉진하여 마사지... ",5ymzsotcjtfq님의블로그,20260309,https://blog.naver.com/5ymzsotcjtfq/224209403255,0,"긍정과 부정이 혼재하거나 뚜렷한 감정 표현이 적어, 수면·이완(담요/수면 보조/힐링 관련) 제품에 대한 평가에 대해 중립에 가까운 평가가 많습니다.",수면 이완 담요 수면개선 힐링 편안 포근한 담요,ko,2025-01-15,naver_blog,date,rule_based_custom_korean_lexicon_v1
수면-이완,앉은 자리에서 꿀잠? 제스파 에어힙 ZP5725 엉덩이... ,"여러 개의 에어 포켓이 정교하게 작동하며, 좌우 비대칭을 잡아주고 골반 불균형 개선에 도움을 줄 수 있습니다. 온열 기능까지 더해져 근육 이완 효과를 극대화하며, 추운 겨울철에도 따뜻하고 포근한... ",보은전자방송통신,20260309,https://blog.naver.com/oe5ppul/224209405644,2,"전반적으로 강한 긍정 경향이 나타나며, 수면·이완(담요/수면 보조/힐링 관련) 제품에 대한 평가에서 기능과 활용도에 대한 만족도가 높습니다.",수면 이완 담요 수면개선 힐링 편안 포근한 담요,ko,2025-01-15,naver_blog,date,rule_based_custom_korean_lexicon_v1
수면-이완,"몸과 마음이 녹아내리는 마사지 꿀팁 베개, 온도, 긴장 해소!","더욱 편안하게 마사지를 즐길 수 있도록 도와줍니다. 춥게 느껴진다면 따뜻한 물수건이나 담요를... 오늘, 나를 위한 마사지 한 시간 어떠세요? #마사지 #편안함 #긴장완화 #온도 #베개 #힐링 #건강",코디조합러,20260309,https://blog.naver.com/xgk98964/224209444556,1,"대체로 약한 긍정 경향이 나타나며, 수면·이완(담요/수면 보조/힐링 관련) 제품에 대한 평가에서 기본적인 효용과 실용성이 인정됩니다.",수면 이완 담요 수면개선 힐링 편안 포근한 담요,ko,2025-01-15,naver_blog,date,rule_based_custom_korean_lexicon_v1
수면-이완,필라테스가 정신 건강에 미치는 놀라운 긍정 효과,"마음이 편안해지는 효과를 경험할 수 있습니다. 필라테스가 우울감 개선에 도움되는 이유 우울한... 둘째, 규칙적인 운동 습관이 형성되면 생활 리듬이 좋아지고, 수면의 질도 함께 향상됩니다. 이는 제 마음도... ",easilybw님의 블로그,20260309,https://blog.naver.com/easilybw/224209445915,2,"전반적으로 강한 긍정 경향이 나타나며, 수면·이완(담요/수면 보조/힐링 관련) 제품에 대한 평가에서 기능과 활용도에 대한 만족도가 높습니다.",수면 이완 담요 수면개선 힐링 편안 포근한 담요,ko,2025-01-15,naver_blog,date,rule_based_custom_korean_lexicon_v1
수면-이완,"2026-03-09 오늘의 운세 오늘 하루, 당신을 안아줄 따뜻한 기운",#오늘의운세#힐링운세#위로#꽃실운세#네이버꽃실#마음챙김#띠별운세#따뜻한말한마디#감성글... ' PLATINUM PICK 1  포근한 담요 '외부의 찬 바람으로부터 당신을 따뜻하게 감싸주니까' 최저가 확인 및... ,꽃실,20260309,https://blog.naver.com/khsoppa/224209447651,1,"대체로 약한 긍정 경향이 나타나며, 수면·이완(담요/수면 보조/힐링 관련) 제품에 대한 평가에서 기본적인 효용과 실용성이 인정됩니다.",수면 이완 담요 수면개선 힐링 편안 포근한 담요,ko,2025-01-15,naver_blog,date,rule_based_custom_korean_lexicon_v1
수면-이완,마사지가 수면 회복 속도를 높이는 몸과 마음의 변화 원리,오늘은 마사지가 어떻게 우리 몸과 뇌를 변화시켜 빠른 수면 회복을 돕는지 살펴보겠습니다. 마사지가 신체 긴장 완화와 혈액 순환 개선에 미치는 영향 우리가 잠들기 전 몸이 편안해야 좋은 잠을 잘 수... ,빅재미예고,20260309,https://blog.naver.com/ebqevwga6/224209355629,1,"대체로 약한 긍정 경향이 나타나며, 수면·이완(담요/수면 보조/힐링 관련) 제품에 대한 평가에서 기본적인 효용과 실용성이 인정됩니다.",수면 이완 담요 수면개선 힐링 편안 포근한 담요,ko,2025-01-15,naver_blog,date,rule_based_custom_korean_lexicon_v1
수면-이완,"포근한 담요 감촉, 송파에서 시작하는 피부 위로","나만을 위한 섬세한 맞춤, 그 편안함에 대하여 일상 속 활력 되찾기 바쁜 하루, 지쳐버린 피부에 활력을... #송파피부관리 #피부관리 #힐링 #피부톤개선 #촉촉함 #탄력 #문정동에스테틱 #송파에스테틱 #맞춤관리 &",여수 삼산 드러스 수영장,20260309,https://blog.naver.com/yzu3xlpoag5/224209505847,2,"전반적으로 강한 긍정 경향이 나타나며, 수면·이완(담요/수면 보조/힐링 관련) 제품에 대한 평가에서 기능과 활용도에 대한 만족도가 높습니다.",수면 이완 담요 수면개선 힐링 편안 포근한 담요,ko,2025-01-15,naver_blog,date,rule_based_custom_korean_lexicon_v1
