category,title,description,blogger,date,link,sentiment_score,sentiment_interpretation,search_query,search_lang,collected_at,platform,sort_option,sentiment_method
수면-이완,세종마사지 서비스 종류별 특징 파악하고 건강 회복 목표... ,"주로 긴장이 많거나 수면의 질을 높이고 싶은 분들에게 권장되며, 강한 압보다는 부드러운 터치로 전신 순환을 돕는 것이 특징입니다. 세종마사지 샵 중에서도 이러한 힐링 중심의 공간들은 편안한 분위기... ",grn1228님의 블로그,20260218,https://blog.naver.com/grn1228/224186832147,1,"대체로 약한 긍정 경향이 나타나며, 수면·이완(담요/수면 보조/힐링 관련) 제품에 대한 평가에서 기본적인 효용과 실용성이 인정됩니다.",수면 이완 담요 수면개선 힐링 편안 포근한 담요,ko,2025-01-15,naver_blog,date,rule_based_custom_korean_lexicon_v1
수면-이완,무안 마사지 종류별 효과 비교와 전문가처럼 만족도 높이는... ,"이러한 맥락에서, 전라남도 무안 지역에서 제공하는 마사지 서비스는 단순한 근육 이완을 넘어선... 자신에게 맞는 최적의 힐링 경로를 설계하여, 심신이 모두 편안한 상태를 유지하는 데 이 지역의 우수한... ",chun5123님의블로그,20260218,https://blog.naver.com/chun5123/224187435357,2,"전반적으로 강한 긍정 경향이 나타나며, 수면·이완(담요/수면 보조/힐링 관련) 제품에 대한 평가에서 기능과 활용도에 대한 만족도가 높습니다.",수면 이완 담요 수면개선 힐링 편안 포근한 담요,ko,2025-01-15,naver_blog,date,rule_based_custom_korean_lexicon_v1
수면-이완,설 연휴 끝나고 목·허리·어깨가 더 아픈 이유 | 명절 후유증... ,"아로마 오일의 치유력 라벤더: 긴장 완화, 수면 개선 마조람: 근육 이완, 통증 완화 로즈마리: 혈액순환... 안전하고 편안한 환경 조명, 온도, 습도 조절 부드러운 음악 은은한 향기 포근한 침대 → 모든 감각이... ",리움결 | 망원 아로마 웰니스,20260218,https://blog.naver.com/rezeun/224187407634,1,"대체로 약한 긍정 경향이 나타나며, 수면·이완(담요/수면 보조/힐링 관련) 제품에 대한 평가에서 기본적인 효용과 실용성이 인정됩니다.",수면 이완 담요 수면개선 힐링 편안 포근한 담요,ko,2025-01-15,naver_blog,date,rule_based_custom_korean_lexicon_v1
수면-이완,"숨겨진 라인 찾기, 판교 필라테스 경험","자세 교정과 코어 강화, 힐링까지! S자 척추, 숨겨진 라인 굽은 어깨와 굳은 허리는 만성 통증의 시작일... 효과적인 이완을 경험할 수 있도록 지도합니다. 스트레스 해소는 물론, 수면의 질 향상에도 기여합니다.... ",v6k56447님의 블로그,20260218,https://blog.naver.com/v6k56447/224187341974,1,"대체로 약한 긍정 경향이 나타나며, 수면·이완(담요/수면 보조/힐링 관련) 제품에 대한 평가에서 기본적인 효용과 실용성이 인정됩니다.",수면 이완 담요 수면개선 힐링 편안 포근한 담요,ko,2025-01-15,naver_blog,date,rule_based_custom_korean_lexicon_v1
수면-이완,허리 찜질기 추천 근적외선 온열 마사지기 비교 분석으로... ,따져본 힐링 템들을 가져왔어요. #허리찜질기 #근적외선찜질기 #온열마사지기 #배찜질기 #어깨찜질기... 있는 포근한 찜질 담요 웰스파 온열복대: 대용량 배터리로 하루 종일 든든한 발열 복대 히트2웨어 무선... ,"최형갭v 부동산, 임장, N잡, 상품리뷰, 블로그",20260218,https://blog.naver.com/gudrkq89/224187323834,2,"전반적으로 강한 긍정 경향이 나타나며, 수면·이완(담요/수면 보조/힐링 관련) 제품에 대한 평가에서 기능과 활용도에 대한 만족도가 높습니다.",수면 이완 담요 수면개선 힐링 편안 포근한 담요,ko,2025-01-15,naver_blog,date,rule_based_custom_korean_lexicon_v1
수면-이완,피로할때 필요한 진주 사천출장마사지 안마,단순히 피로를 푸는 방법이 아니라 몸과 마음의 균형을 회복하는 하나의 힐링 방법이다. 그렇다면... 퇴근 후 바로 휴식 모드로 전환하면서 마사지를 받으면 수면의 질도 함께 개선되는 경우가 많다. 또한 중요한... ,사천 진주출장마사지,20260218,https://blog.naver.com/jinjuthai14/224187323069,2,"전반적으로 강한 긍정 경향이 나타나며, 수면·이완(담요/수면 보조/힐링 관련) 제품에 대한 평가에서 기능과 활용도에 대한 만족도가 높습니다.",수면 이완 담요 수면개선 힐링 편안 포근한 담요,ko,2025-01-15,naver_blog,date,rule_based_custom_korean_lexicon_v1
수면-이완,"[충주위담통합병원] 암 치료 후 재활, 회복의 마지막이 아니라... ",이러한 심리적 부담은 수면의 질을 떨어뜨리고 회복 속도를 늦추는 요인이 되기도 합니다. 실제로 국내... 네이처 힐링은자연과 함께하는 공간에서의 휴식을 통해 긴장된 신체와 마음을 이완시키는 데 도움을... ,충주위담통합병원,20260218,https://blog.naver.com/cjweedahm3/224184772546,2,"전반적으로 강한 긍정 경향이 나타나며, 수면·이완(담요/수면 보조/힐링 관련) 제품에 대한 평가에서 기능과 활용도에 대한 만족도가 높습니다.",수면 이완 담요 수면개선 힐링 편안 포근한 담요,ko,2025-01-15,naver_blog,date,rule_based_custom_korean_lexicon_v1
수면-이완,제주 중문 본테라피 마사지 효과와 집에서 하는 셀프 힐링 방법,"마사지 후 피로 회복과 숙면에 미치는 영향 본테라피 마사지는 근육 이완뿐 아니라 혈액순환 개선을 통해 신진대사를 촉진합니다. 이로 인해 신체 전반의 피로가 빠르게 해소되고, 긴장 완화로 수면의 질이... ",흰하수,20260218,https://blog.naver.com/evacuate13443/224187220354,2,"전반적으로 강한 긍정 경향이 나타나며, 수면·이완(담요/수면 보조/힐링 관련) 제품에 대한 평가에서 기능과 활용도에 대한 만족도가 높습니다.",수면 이완 담요 수면개선 힐링 편안 포근한 담요,ko,2025-01-15,naver_blog,date,rule_based_custom_korean_lexicon_v1
수면-이완,"따뜻한 포근함, 플레이베어 커플 잠옷",무엇보다도 편안하고 따뜻한 옷을 찾게 됩니다. 최근에 발견한 플레이베어 커플 수면잠옷은 그런 니즈를 완벽히 충족시켜주는 제품입니다. 포근한 착용감 플레이베어 커플 수면잠옷의 가장 큰 장점은 바로 기모... ,qmqwlws62v님의 블로그,20260218,https://blog.naver.com/qmqwlws62v/224187208888,0,"긍정과 부정이 혼재하거나 뚜렷한 감정 표현이 적어, 수면·이완(담요/수면 보조/힐링 관련) 제품에 대한 평가에 대해 중립에 가까운 평가가 많습니다.",수면 이완 담요 수면개선 힐링 편안 포근한 담요,ko,2025-01-15,naver_blog,date,rule_based_custom_korean_lexicon_v1
수면-이완,Hygge - Barbara Hayden,"촛불, 따뜻한 조명, 포근한 직물 같은 환경 요소는 신체의 긴장을 완화하고 안정감을 유도한다. 이는 신경계의 이완 반응과 연결된다. ✒️ 핵심 발췌  “Soft lighting and warm spaces signal safety to the... ",twainnnn님의블로그,20260218,https://blog.naver.com/twainnnn/224187205733,0,"긍정과 부정이 혼재하거나 뚜렷한 감정 표현이 적어, 수면·이완(담요/수면 보조/힐링 관련) 제품에 대한 평가에 대해 중립에 가까운 평가가 많습니다.",수면 이완 담요 수면개선 힐링 편안 포근한 담요,ko,2025-01-15,naver_blog,date,rule_based_custom_korean_lexicon_v1
수면-이완,베개 고르는 법 수면 자세별 적정 높이 소재 추천 교체 주기,분위기에서 힐링할 수 있는 영암펜션독채 장소를 알아보다가 이곳을 발... https://blog.naver.com/lidyaa_/224186927833?fromRss=true&trackingCode=rss #숙면방법 #베개선택법 #경추베개추천 #라텍스베개장점 #수면환경개선... ,⭐ ✅잇츠인포✅ ⭐,20260218,https://blog.naver.com/lidyaa_/224187148327,5,"전반적으로 강한 긍정 경향이 나타나며, 수면·이완(담요/수면 보조/힐링 관련) 제품에 대한 평가에서 기능과 활용도에 대한 만족도가 높습니다.",수면 이완 담요 수면개선 힐링 편안 포근한 담요,ko,2025-01-15,naver_blog,date,rule_based_custom_korean_lexicon_v1
수면-이완,"서울 힐링 추천, 5D힐링센터 싱잉볼·레이키·별자리 명상 대면... ","여기에 레이키 에너지 힐링이 더해져 몸과 마음, 감정의 균형을 자연스럽게 회복하도록 돕습니다. ✔ 깊은 이완과 스트레스 완화 ✔ 수면의 질 개선 ✔ 감정 정화 및 에너지 밸런스 회복 ✔ 번아웃... ",고고의 도토리 꾸러미,20260218,https://blog.naver.com/gogo-m/224186899255,5,"전반적으로 강한 긍정 경향이 나타나며, 수면·이완(담요/수면 보조/힐링 관련) 제품에 대한 평가에서 기능과 활용도에 대한 만족도가 높습니다.",수면 이완 담요 수면개선 힐링 편안 포근한 담요,ko,2025-01-15,naver_blog,date,rule_based_custom_korean_lexicon_v1
수면-이완,서귀포마사지 현명하게 선택하는 단계별 지침으로 최상의 휴식... ,"위한 힐링 경험을 원하는지에 따라 선택지가 달라집니다. 예를 들어, 장거리 운전으로 인한 허리 뭉침이 주된 문제라면 압력 강도가 높은 집중 관리가 필요하며, 수면의 질 개선이 목표라면 심신 안정에 중점을... ",쩐녀ෆ,20260218,https://blog.naver.com/duwjd2186/224186999919,1,"대체로 약한 긍정 경향이 나타나며, 수면·이완(담요/수면 보조/힐링 관련) 제품에 대한 평가에서 기본적인 효용과 실용성이 인정됩니다.",수면 이완 담요 수면개선 힐링 편안 포근한 담요,ko,2025-01-15,naver_blog,date,rule_based_custom_korean_lexicon_v1
수면-이완,중문 마사지 관리 유형별 특징 분석과 최적의 릴랙세이션... ,"하나의 힐링 콘텐츠로 기능합니다. 이 지역의 마사지 샵들은 각기 고유한 철학과 기술을 바탕으로... 예를 들어, 만약 수면의 질 개선을 주된 목적으로 한다면, 심신 이완에 중점을 둔 저자극 테크닉을 선호하고... ",유니유니의 이야기,20260218,https://blog.naver.com/blueteak/224186996253,2,"전반적으로 강한 긍정 경향이 나타나며, 수면·이완(담요/수면 보조/힐링 관련) 제품에 대한 평가에서 기능과 활용도에 대한 만족도가 높습니다.",수면 이완 담요 수면개선 힐링 편안 포근한 담요,ko,2025-01-15,naver_blog,date,rule_based_custom_korean_lexicon_v1
수면-이완,추운 캠핑 밤 고민 끝! 집앤콕 대형 극세사 담요 보온성 총정리,집에서 편안하고 따뜻한 휴식을 원하시는 분들 → 구름처럼 부드러운 촉감과 빠른 온기로 깊이 있는 힐링 타임을 선사할 거예요. 3. 온 가족이 함께 사용할 다용도 담요를 찾으시는 분들 → 대형 사이즈와 손쉬운... ,삼공육팔의 이런저런 세상이야기,20260218,https://blog.naver.com/3068u5hm/224185190812,1,"대체로 약한 긍정 경향이 나타나며, 수면·이완(담요/수면 보조/힐링 관련) 제품에 대한 평가에서 기본적인 효용과 실용성이 인정됩니다.",수면 이완 담요 수면개선 힐링 편안 포근한 담요,ko,2025-01-15,naver_blog,date,rule_based_custom_korean_lexicon_v1
수면-이완,서귀포 마사지 관리 유형별 특징 이해와 여행자 심신 안정 얻는... ,"얻은 편안함과 재충전의 에너지는 앞으로의 일상생활을 더욱 활기차게 이끌어 나가는 원동력이 될 것입니다. 제주의 자연이 주는 치유의 힘과 전문적인 관리 기술이 결합될 때, 진정한 의미의 힐링을 경험할 수... ",이젠 다시 태어난거야..,20260218,https://blog.naver.com/jhu8622/224186992467,1,"대체로 약한 긍정 경향이 나타나며, 수면·이완(담요/수면 보조/힐링 관련) 제품에 대한 평가에서 기본적인 효용과 실용성이 인정됩니다.",수면 이완 담요 수면개선 힐링 편안 포근한 담요,ko,2025-01-15,naver_blog,date,rule_based_custom_korean_lexicon_v1
수면-이완,"수면장애마사지, 꿀잠 부르는 나만의 비법 공개","특히, 수기 림프 드레나지와 같은 부드러운 마사지는 수면의 질을 직접적으로 개선하여 잠드는 시간을... 잠들기 전 편안한 수면 루틴을 만드는 것, 규칙적인 스트레칭으로 몸의 긴장을 풀어주는 것, 바른 자세를... ",@송도마사지 by KENZO,20260218,https://blog.naver.com/mrs9442/224175006346,1,"대체로 약한 긍정 경향이 나타나며, 수면·이완(담요/수면 보조/힐링 관련) 제품에 대한 평가에서 기본적인 효용과 실용성이 인정됩니다.",수면 이완 담요 수면개선 힐링 편안 포근한 담요,ko,2025-01-15,naver_blog,date,rule_based_custom_korean_lexicon_v1
수면-이완,건강 관심자를 위한 안양마사지 서비스 종류별 특징과 현명한... ,"두 번째로, 스트레스 호르몬 감소 및 수면의 질 개선 효과를 기대할 수 있습니다. 마사지 과정에서 분비되는 엔도르핀과 세로토닌은 심신을 안정시키고 긴장을 완화합니다. 이완된 상태는 깊고 편안한 수면을... ",나에 일상 너에 일상,20260218,https://blog.naver.com/ioloolol/224186955318,1,"대체로 약한 긍정 경향이 나타나며, 수면·이완(담요/수면 보조/힐링 관련) 제품에 대한 평가에서 기본적인 효용과 실용성이 인정됩니다.",수면 이완 담요 수면개선 힐링 편안 포근한 담요,ko,2025-01-15,naver_blog,date,rule_based_custom_korean_lexicon_v1
수면-이완,서귀포마사지 유형별 특징 분석으로 여행자 맞춤형 힐링 경험... ,"이 서비스는 단순한 신체 접촉을 넘어, 방문객들에게 깊은 이완과 활력을 되찾아주는 중요한 요소로... 후 편안하게 숙면을 유도하는 수면 유도 프로그램을 운영하는 곳들이 늘고 있습니다. 이는 고객이 자신의... ",다양한 소개,20260218,https://blog.naver.com/exo5010/224186954181,1,"대체로 약한 긍정 경향이 나타나며, 수면·이완(담요/수면 보조/힐링 관련) 제품에 대한 평가에서 기본적인 효용과 실용성이 인정됩니다.",수면 이완 담요 수면개선 힐링 편안 포근한 담요,ko,2025-01-15,naver_blog,date,rule_based_custom_korean_lexicon_v1
수면-이완,서귀포마사지 서비스 유형별 특징 이해 후 힐링 효과를 오래... ,"제주 남쪽 도시의 힐링 요소, 서귀포마사지 이해하기 제주도는 사계절 내내 많은 이들이 찾는... 이 지역에서 제공되는 마사지 서비스는 단순한 근육 이완을 넘어, 여행 일정으로 인해 쌓인 육체적, 정신적 피로를... ",홍홍~♥,20260218,https://blog.naver.com/elliss02/224186941519,2,"전반적으로 강한 긍정 경향이 나타나며, 수면·이완(담요/수면 보조/힐링 관련) 제품에 대한 평가에서 기능과 활용도에 대한 만족도가 높습니다.",수면 이완 담요 수면개선 힐링 편안 포근한 담요,ko,2025-01-15,naver_blog,date,rule_based_custom_korean_lexicon_v1
수면-이완,목포 마사지 서비스 종류별 효과 파악하고 맞춤형 힐링 경험... ,"목포의 아름다운 경관과 더불어 편안한 마사지 경험은 심리적 안정감을 제공하며, 이는 여행의 기억 자체를 더욱 긍정적으로 만듭니다. 심신의 긴장이 완화되면 수면의 질 역시 향상되므로, 다음 날의 활동에... ",oheel91799님의 블로그,20260218,https://blog.naver.com/oheel91799/224186920297,1,"대체로 약한 긍정 경향이 나타나며, 수면·이완(담요/수면 보조/힐링 관련) 제품에 대한 평가에서 기본적인 효용과 실용성이 인정됩니다.",수면 이완 담요 수면개선 힐링 편안 포근한 담요,ko,2025-01-15,naver_blog,date,rule_based_custom_korean_lexicon_v1
수면-이완,자연의 편안함을 담은 흙침대 활용법,자연의 편안함을 담은 흙침대 활용법 ▲▲상단 링크를 방문해서 확인 바랍니다▲▲ 집에서의 시간을... 수면의 질 개선 수면을 중시하는 친구에게 추천해주고 싶은 제품이기도 해요. 황토로 구성된 매트리스는... ,hqlwgd208d님의 블로그,20260218,https://blog.naver.com/hqlwgd208d/224187103016,2,"전반적으로 강한 긍정 경향이 나타나며, 수면·이완(담요/수면 보조/힐링 관련) 제품에 대한 평가에서 기능과 활용도에 대한 만족도가 높습니다.",수면 이완 담요 수면개선 힐링 편안 포근한 담요,ko,2025-01-15,naver_blog,date,rule_based_custom_korean_lexicon_v1
수면-이완,집에서 휴식할 때 좋은 아이템 신속히 탐구 대상이에요,"라벤더 오일은 편안한 수면을 유도하고, 페퍼민트는 집중력을 높이는데 효과적입니다. 이런 아로마의... 아로마 디퓨저의 인센스와 함께하는 잔잔한 음악, 포근한 담요에 쌓여 편안한 엎드림으로 시간을 보내며... ",소소한 일상 이야기,20260219,https://blog.naver.com/hiiuf788/224188184083,0,"긍정과 부정이 혼재하거나 뚜렷한 감정 표현이 적어, 수면·이완(담요/수면 보조/힐링 관련) 제품에 대한 평가에 대해 중립에 가까운 평가가 많습니다.",수면 이완 담요 수면개선 힐링 편안 포근한 담요,ko,2025-01-15,naver_blog,date,rule_based_custom_korean_lexicon_v1
수면-이완,동국제약 굿잠 병풀 스팀안대 무직타이거 10입 5박스 / 수면... ,피부를 편안하게 진정시켜 주어 더욱 깊은 휴식을 도와줍니다. ✅ 약 40°C의 포근한 '스팀 온열... 풍부한 스팀이 뻣뻣해진 눈 주위 근육을 부드럽게 이완시키고 건조한 눈을 촉촉하게 케어합니다.  귀여움... ,무지개 상점,20260219,https://blog.naver.com/neomi859269/224188239155,0,"긍정과 부정이 혼재하거나 뚜렷한 감정 표현이 적어, 수면·이완(담요/수면 보조/힐링 관련) 제품에 대한 평가에 대해 중립에 가까운 평가가 많습니다.",수면 이완 담요 수면개선 힐링 편안 포근한 담요,ko,2025-01-15,naver_blog,date,rule_based_custom_korean_lexicon_v1
수면-이완,한방 '마음 힐링'으로 편안하게 극복! ✨ (여성 건강 & 정신 건강),"및 이완을 위한 상담 치료를 병행하기도 합니다. 명상, 호흡법 등을 통해 스스로 감정을 조절하고 스트레스를 해소하는 방법을 익히도록 돕습니다.  이젠 편안하고 빛나는 나! 일상생활 속 '갱년기 마음 힐링... ",@@,20260219,https://blog.naver.com/bluesky_1015/224175966843,2,"전반적으로 강한 긍정 경향이 나타나며, 수면·이완(담요/수면 보조/힐링 관련) 제품에 대한 평가에서 기능과 활용도에 대한 만족도가 높습니다.",수면 이완 담요 수면개선 힐링 편안 포근한 담요,ko,2025-01-15,naver_blog,date,rule_based_custom_korean_lexicon_v1
수면-이완,배가 콕콕 쑤셔요 오른쪽 아랫배 통증 원인과 병원 가야 할 신호,"따뜻한 온기는 긴장된 장 근육을 이완시켜 콕콕 쑤시는 느낌을 줄여주는 데 정말 정말 효과적입니다. 따뜻한 찜질팩과 포근한 담요가 있는 편안한 휴식 공간 또한 자세를 바꾸는 것도 도움이 되는데, 옆으로... ",메디컬 인사이트,20260219,https://blog.naver.com/newstartguide/224188513394,1,"대체로 약한 긍정 경향이 나타나며, 수면·이완(담요/수면 보조/힐링 관련) 제품에 대한 평가에서 기본적인 효용과 실용성이 인정됩니다.",수면 이완 담요 수면개선 힐링 편안 포근한 담요,ko,2025-01-15,naver_blog,date,rule_based_custom_korean_lexicon_v1
수면-이완,부산북구 수족냉증 - 편안한 온기를 지킬 수 있는 방법,"근육 따뜻한 양말이나 수면 안대, 그리고 전기담요를 사용하여 편안한 수면 환경을 조성할 수 있습니다.... 강동구 예를 들어, 발목을 돌리거나 발가락을 움직이는 간단한 스트레칭을 통해 혈액순환을 개선할 수... ",None,20260219,https://blog.naver.com/lrbxg2s5/224188515327,1,"대체로 약한 긍정 경향이 나타나며, 수면·이완(담요/수면 보조/힐링 관련) 제품에 대한 평가에서 기본적인 효용과 실용성이 인정됩니다.",수면 이완 담요 수면개선 힐링 편안 포근한 담요,ko,2025-01-15,naver_blog,date,rule_based_custom_korean_lexicon_v1
수면-이완,연산동 피부관리실 웰니스존 피부부터 바디까지,동시에 이완시켜 줍니다. 조용하고 아늑한 분위기 속에서 받는 관리 시간은 단순한 피부관리 시간이... 진짜 힐링 케어. 연산동 피부관리실 웰니스존에서 자연이 주는 편안함과 전문적인 테라피를 동시에... ,"웰니스존-피부관리,웨딩케어에서 출산까지",20260219,https://blog.naver.com/hau6fd/224188708309,1,"대체로 약한 긍정 경향이 나타나며, 수면·이완(담요/수면 보조/힐링 관련) 제품에 대한 평가에서 기본적인 효용과 실용성이 인정됩니다.",수면 이완 담요 수면개선 힐링 편안 포근한 담요,ko,2025-01-15,naver_blog,date,rule_based_custom_korean_lexicon_v1
수면-이완,냉증 완화를 위한 효과적인 관리법,"규칙적인 수면 패턴을 유지하고, 편안한 수면 환경을 조성하여 몸이 충분한 휴식을 취할 수 있도록 해야 합니다. 또한, 수면 중 체온이 쉽게 떨어지지 않도록 따뜻한 담요를 사용하는 것도 좋은 방법입니다. 6.... ",워킹맘블로그,20260219,https://blog.naver.com/ddalgi215-/224188621681,0,"긍정과 부정이 혼재하거나 뚜렷한 감정 표현이 적어, 수면·이완(담요/수면 보조/힐링 관련) 제품에 대한 평가에 대해 중립에 가까운 평가가 많습니다.",수면 이완 담요 수면개선 힐링 편안 포근한 담요,ko,2025-01-15,naver_blog,date,rule_based_custom_korean_lexicon_v1
수면-이완,한의학적 병리 기전에 입각한 만성 피부 질환 및 대사 증후군의... ,"특히 현대인들의 불규칙한 수면과 식습관은 '위열(胃熱)'을 조장하여 구진과 농포를 악화시키는 주된... 피부는 내장의 거울이라는 말처럼, 속을 편안하게 다스려 맑은 혈액이 공급되도록 하는 내부 환경 개선이... ",zcqcgng747님의 블로그,20260219,https://blog.naver.com/zcqcgng747/224188687046,1,"대체로 약한 긍정 경향이 나타나며, 수면·이완(담요/수면 보조/힐링 관련) 제품에 대한 평가에서 기본적인 효용과 실용성이 인정됩니다.",수면 이완 담요 수면개선 힐링 편안 포근한 담요,ko,2025-01-15,naver_blog,date,rule_based_custom_korean_lexicon_v1
수면-이완,송도 생리통 스스로 완화 방법은 무엇일까,편안한 환경을 만드는 노력? 3. 충분한 휴식의 중요성? 4. 균형 잡힌 식사가 기분을 좋게? 5. 적절한... 근육을 이완시키고 전반적인 혈액 순환을 개선하는 데 도움을 줄 수 있습니다. 동반 남동구청역생리통 특히... ,백록담한의원 인천 송도,20260219,https://blog.naver.com/merelyqjc/224188706002,2,"전반적으로 강한 긍정 경향이 나타나며, 수면·이완(담요/수면 보조/힐링 관련) 제품에 대한 평가에서 기능과 활용도에 대한 만족도가 높습니다.",수면 이완 담요 수면개선 힐링 편안 포근한 담요,ko,2025-01-15,naver_blog,date,rule_based_custom_korean_lexicon_v1
수면-이완,"꿈결처럼 포근한 침실, 자연 담은 인테리어 마법!","꿈결처럼 포근한 침실, 자연 담은 인테리어 마법! 아늑한 침실, 나만의 작은 쉼터로! 숨 막히는 하루 끝... 침구는 편안한 수면 환경을 조성하는 데 도움을 줍니다. 푹신한 쿠션이나 담요를 활용하여 포근함을... ",Physiohyeon,20260219,https://blog.naver.com/zhdiuhtrio/224188116474,1,"대체로 약한 긍정 경향이 나타나며, 수면·이완(담요/수면 보조/힐링 관련) 제품에 대한 평가에서 기본적인 효용과 실용성이 인정됩니다.",수면 이완 담요 수면개선 힐링 편안 포근한 담요,ko,2025-01-15,naver_blog,date,rule_based_custom_korean_lexicon_v1
수면-이완,편안하게 잠들기전 수면루틴 캄온수매트로 바꿨어요,"싱글 사이즈의 캄온수매트는 보드라운 담요처럼 제작되어 있어 사실 그 자체만으로 포근한 느낌 덕분에... 긴장이 이완되면서 편안한 상태로 돌입, 잠들기전 캄온수매트 켜는게 이제는 수면루틴이 되어버린 것!... ",깔로의 감성일쌍다반사:D,20260219,https://blog.naver.com/ujins928/224188733748,0,"긍정과 부정이 혼재하거나 뚜렷한 감정 표현이 적어, 수면·이완(담요/수면 보조/힐링 관련) 제품에 대한 평가에 대해 중립에 가까운 평가가 많습니다.",수면 이완 담요 수면개선 힐링 편안 포근한 담요,ko,2025-01-15,naver_blog,date,rule_based_custom_korean_lexicon_v1
