category,title,description,blogger,date,link,sentiment_score,sentiment_interpretation,search_query,search_lang,collected_at,platform,sort_option,sentiment_method
수면-이완,"촉촉한 손길, 마곡마사지의 부드러운 재발견","향상시키고, 수면의 질을 개선하는 데 긍정적인 영향을 미친다고 해요. 앞으로도 꾸준히 마곡마사지를 방문하여 몸과 마음의 건강을 관리해야겠어요. 건강한 습관 형성 #마곡마사지 #힐링 #아로마 #스톤테라피... ",더위를 날리는 힐링,20260303,https://blog.naver.com/pv2jo0vr/224202221064,2,"전반적으로 강한 긍정 경향이 나타나며, 수면·이완(담요/수면 보조/힐링 관련) 제품에 대한 평가에서 기능과 활용도에 대한 만족도가 높습니다.",수면 이완 담요 수면개선 힐링 편안 포근한 담요,ko,2025-01-15,naver_blog,date,rule_based_custom_korean_lexicon_v1
수면-이완,빛나는 피부를 위한 3Step! 홈케어부터 숙면 스트레칭까지!,"수면 전 간단 전신 스트레칭으로 힐링하세요! 잠들기 전, 스마트폰은 잠시 내려놓고 몸과 마음을 편안하게 이완시키는 시간을 가져보세요. 수면 전 간단 전신 스트레칭은 근육의 긴장을 풀어주고... ",ib8zx97ub님의 블로그,20260303,https://blog.naver.com/ib8zx97ub/224202239554,1,"대체로 약한 긍정 경향이 나타나며, 수면·이완(담요/수면 보조/힐링 관련) 제품에 대한 평가에서 기본적인 효용과 실용성이 인정됩니다.",수면 이완 담요 수면개선 힐링 편안 포근한 담요,ko,2025-01-15,naver_blog,date,rule_based_custom_korean_lexicon_v1
수면-이완,서귀포 마사지 유형별 특징 이해와 여행자 힐링 경험 극대화 방안,"아름다운 자연환경으로 유명한 서귀포 지역에서 제공되는 이러한 힐링 서비스는 방문객들에게... 신체가 편안해지면 수면의 질이 개선되고, 이는 곧 집중력 향상과 긍정적인 기분 유지로 이어집니다.... ",나만의 시크릿 공간★,20260303,https://blog.naver.com/realityboy/224202247265,3,"전반적으로 강한 긍정 경향이 나타나며, 수면·이완(담요/수면 보조/힐링 관련) 제품에 대한 평가에서 기능과 활용도에 대한 만족도가 높습니다.",수면 이완 담요 수면개선 힐링 편안 포근한 담요,ko,2025-01-15,naver_blog,date,rule_based_custom_korean_lexicon_v1
수면-이완,"포근한 온기, 마곡마사지가 전하는 부드러운 시작","마사지 전후로 제공되는 따뜻한 차 한 잔은 몸과 마음을 더욱 편안하게 만들어주어, 힐링 효과를... 따뜻한 돌을 이용하여 몸의 긴장을 부드럽게 이완시켜주는 핫스톤 마사지는 혈액순환 개선과 근육 이완에... ",텅빈마음속,20260303,https://blog.naver.com/1zvw4wbh/224201978239,2,"전반적으로 강한 긍정 경향이 나타나며, 수면·이완(담요/수면 보조/힐링 관련) 제품에 대한 평가에서 기능과 활용도에 대한 만족도가 높습니다.",수면 이완 담요 수면개선 힐링 편안 포근한 담요,ko,2025-01-15,naver_blog,date,rule_based_custom_korean_lexicon_v1
수면-이완,숙면을 위한 수면 유도 차 5종,"하지만 페퍼민트는 근육 이완과 소화 개선에 도움을 주어, 긴장성 불면에 의외로 잘 맞습니다. 하루... 편안한 잠으로 가는 작은 의식 수면 유도 차는 기적의 약이 아닙니다. 하지만 잠들기 전, 나 자신을 돌보는... ",nkjtolk8wb님의 블로그,20260303,https://blog.naver.com/nkjtolk8wb/224203141045,2,"전반적으로 강한 긍정 경향이 나타나며, 수면·이완(담요/수면 보조/힐링 관련) 제품에 대한 평가에서 기능과 활용도에 대한 만족도가 높습니다.",수면 이완 담요 수면개선 힐링 편안 포근한 담요,ko,2025-01-15,naver_blog,date,rule_based_custom_korean_lexicon_v1
수면-이완,VTLA 모아온 황토맥반석 전기찜질기 기본형으로 따뜻한 힐링... ,"연구에 따르면, 온열 요법은 스트레스 완화와 수면 질 개선에도 긍정적인 영향을 미친다고 합니다. VTLA 모아온 황토맥반석 전기찜질기를 사용하면 하루의 피로를 풀고, 보다 편안한 수면을 취할 수 있는 기회를... ",qrzyvhbi님의 블로그,20260303,https://blog.naver.com/qrzyvhbi/224203208458,2,"전반적으로 강한 긍정 경향이 나타나며, 수면·이완(담요/수면 보조/힐링 관련) 제품에 대한 평가에서 기능과 활용도에 대한 만족도가 높습니다.",수면 이완 담요 수면개선 힐링 편안 포근한 담요,ko,2025-01-15,naver_blog,date,rule_based_custom_korean_lexicon_v1
수면-이완,"고요한 새벽, 작은 소리에도 움찔 놀라는 나","낮 동안 쌓인 스트레스와 긴장이 해소되지 못하고, 잠자리에 들어서도 몸이 완전히 이완되지 못하는... #신경예민 #체질관리 #한의학 #식이요법 #스트레스 #심장두근거림 #수면 #건강 #힐링 #마음챙김",xfaaczxxys님의블로그,20260304,https://blog.naver.com/xfaaczxxys/224203292389,1,"대체로 약한 긍정 경향이 나타나며, 수면·이완(담요/수면 보조/힐링 관련) 제품에 대한 평가에서 기본적인 효용과 실용성이 인정됩니다.",수면 이완 담요 수면개선 힐링 편안 포근한 담요,ko,2025-01-15,naver_blog,date,rule_based_custom_korean_lexicon_v1
수면-이완,불면증에 도움되는 요가동작에 대해 알아보아요.,"각 동작은 3~5분 정도 유지하며, 깊고 편안한 호흡에 집중합니다. 1. 다리 벽에 대기 (Viparita Karani) '심신 이완의 최고봉, 피로 해소와 혈액순환 개선' 설명: 이 자세는 다리의 피로를 풀고, 심장으로 가는 혈액... ",다이아요가 공식블로그,20260304,https://blog.naver.com/angels_yoga/224203848069,4,"전반적으로 강한 긍정 경향이 나타나며, 수면·이완(담요/수면 보조/힐링 관련) 제품에 대한 평가에서 기능과 활용도에 대한 만족도가 높습니다.",수면 이완 담요 수면개선 힐링 편안 포근한 담요,ko,2025-01-15,naver_blog,date,rule_based_custom_korean_lexicon_v1
수면-이완,인천 숭의역 디톡스 효소찜질 37.5효소원 가격 효소테라피... ,"스트레스, 수면 문제 겪는 분 ✅ 수분만 빼는 사우나가 부담스러운 분 ✅ 몸이 계속 붓거나 무거운 신... 덜해 편안하고 힐링되는 느낌 ✅ 효소 찜질하고나니 확실히 몸이 가벼워지고 붓기가 빠짐 ✅ 부모님... ",탕탕맘,20260304,https://blog.naver.com/wlsk4075/224203841475,0,"긍정과 부정이 혼재하거나 뚜렷한 감정 표현이 적어, 수면·이완(담요/수면 보조/힐링 관련) 제품에 대한 평가에 대해 중립에 가까운 평가가 많습니다.",수면 이완 담요 수면개선 힐링 편안 포근한 담요,ko,2025-01-15,naver_blog,date,rule_based_custom_korean_lexicon_v1
수면-이완,서귀포 마사지 유형별 특징 이해와 여행자 웰빙 유지를 위한... ,"서귀포 마사지는 단순한 근육 이완을 넘어, 여행의 질을 높이는 필수적인 요소로 자리 잡고 있습니다.... 여행 중 발생하는 정신적 긴장이나 수면의 질 저하를 개선하고자 할 때 매우 유용합니다. 이 유형을... ",안주하나 맛집하나,20260304,https://blog.naver.com/wodydaos/224203873779,1,"대체로 약한 긍정 경향이 나타나며, 수면·이완(담요/수면 보조/힐링 관련) 제품에 대한 평가에서 기본적인 효용과 실용성이 인정됩니다.",수면 이완 담요 수면개선 힐링 편안 포근한 담요,ko,2025-01-15,naver_blog,date,rule_based_custom_korean_lexicon_v1
수면-이완,출산 후 붓기 완화 산후마사지  바디튠동탄점,골반 주변 이완 도움 출산 후 긴장된 골반·허리 근육을 풀어 편안함 유지에 긍정적인 영향을 줄 수 있습니다. ⭐ 3. 피로 회복 도움 수면 부족으로 지친 몸의 전신 피로 완화에 도움을 줄 수 있습니다. ⭐ 4. 정서... ,white memory,20260304,https://blog.naver.com/white_memory22/224203251435,3,"전반적으로 강한 긍정 경향이 나타나며, 수면·이완(담요/수면 보조/힐링 관련) 제품에 대한 평가에서 기능과 활용도에 대한 만족도가 높습니다.",수면 이완 담요 수면개선 힐링 편안 포근한 담요,ko,2025-01-15,naver_blog,date,rule_based_custom_korean_lexicon_v1
수면-이완,부산 갑상선암 면역치료 한방 요양병원 어디로?,"세심한 근육 이완 치료를 통해 목의 가동 범위를 회복시키고, 림프 배액 마사지로 얼굴과 목의 부기를 빠르게 완화합니다. 4. 도심 속 프리미엄 힐링 공간 무이재 한방병원은 환우분들이 병원이라는 느낌보다는... ",JJ건강정보모아,20260304,https://blog.naver.com/ilxyal8040/224203986339,1,"대체로 약한 긍정 경향이 나타나며, 수면·이완(담요/수면 보조/힐링 관련) 제품에 대한 평가에서 기본적인 효용과 실용성이 인정됩니다.",수면 이완 담요 수면개선 힐링 편안 포근한 담요,ko,2025-01-15,naver_blog,date,rule_based_custom_korean_lexicon_v1
수면-이완,빗소리 ASMR의 비밀: 왜 우리는 빗소리를 들을 때 비로소... ,"더 편안하고 안정적입니다. 연구에 따르면 핑크 노이즈는 수면 중 뇌파를 안정시켜 깊은 수면(서파... 깊은 이완, 명상 유도 2. 진화의 기억: 비는 곧 '안전'이었다 우리가 빗소리를 들으며 평온함을 느끼는... ",아라리브,20260304,https://blog.naver.com/1980man/224196855056,0,"긍정과 부정이 혼재하거나 뚜렷한 감정 표현이 적어, 수면·이완(담요/수면 보조/힐링 관련) 제품에 대한 평가에 대해 중립에 가까운 평가가 많습니다.",수면 이완 담요 수면개선 힐링 편안 포근한 담요,ko,2025-01-15,naver_blog,date,rule_based_custom_korean_lexicon_v1
수면-이완,눈 떨림 증상과 간 피로가 함께 나타나는 이유와 관리법,"간 피로는 술자리 잦음이나 기름진 음식 과다 섭취뿐 아니라 스트레스 누적, 수면 부족 등 다양한... 보다 활기차고 편안한 일상을 되찾는데 큰 도움이 될 거예요. #눈떨림관리 #간건강챙기기 #생활습관개선",건강한 아침 가족 밥상,20260304,https://blog.naver.com/file2239/224204041209,2,"전반적으로 강한 긍정 경향이 나타나며, 수면·이완(담요/수면 보조/힐링 관련) 제품에 대한 평가에서 기능과 활용도에 대한 만족도가 높습니다.",수면 이완 담요 수면개선 힐링 편안 포근한 담요,ko,2025-01-15,naver_blog,date,rule_based_custom_korean_lexicon_v1
수면-이완,"[원데이 클래스]묵은 피로를 비우는 봄의 생명력, 싱잉볼... ","' 그 다정한 피드백들을 소중히 모아, 이번에는 오직 '깊은 이완' 그 자체에만 집중하는 사운드 힐링... 편안한 옷차림으로 와주세요. 요가매트, 테라피급 아로마 오일, 온열 안대, 그리고 포근한 담요까지 모두... ",소예통합치유 요가•싱잉볼명상•아로마테라피,20260304,https://blog.naver.com/soyey/224204068444,1,"대체로 약한 긍정 경향이 나타나며, 수면·이완(담요/수면 보조/힐링 관련) 제품에 대한 평가에서 기본적인 효용과 실용성이 인정됩니다.",수면 이완 담요 수면개선 힐링 편안 포근한 담요,ko,2025-01-15,naver_blog,date,rule_based_custom_korean_lexicon_v1
수면-이완,"헉, 이대로 두면 안 되겠더라고요! 힐링이 절실했던 순간들","이제는 나만의 속도로 천천히 가도 괜찮아요 제 몸 상태를 제대로 확인하고 나에게 맞는 힐링 방법을 찾고 나니, 마음이 정말 가벼워졌어요. 억지로 애쓰지 않아도 괜찮다는 안도감이랄까요? 몸이 편안해지니... ",가슴에 남은 추억들,20260304,https://blog.naver.com/florentine95224/224203474955,4,"전반적으로 강한 긍정 경향이 나타나며, 수면·이완(담요/수면 보조/힐링 관련) 제품에 대한 평가에서 기능과 활용도에 대한 만족도가 높습니다.",수면 이완 담요 수면개선 힐링 편안 포근한 담요,ko,2025-01-15,naver_blog,date,rule_based_custom_korean_lexicon_v1
수면-이완,무실동두피 탈모예방에도 효과적,전반이 이완되어 통증 완화에도 큰 도움이 된다고 설명해 주셨습니다 따스한 온기 속에 있으니 마음까지 평온해지는 힐링의 시간이었습니다 모든 관리가 끝난 뒤에는 엔딩 테라피와 함께 모발 에센스 도포로... ,불꽃축제,20260304,https://blog.naver.com/wzzf041/224204159443,3,"전반적으로 강한 긍정 경향이 나타나며, 수면·이완(담요/수면 보조/힐링 관련) 제품에 대한 평가에서 기능과 활용도에 대한 만족도가 높습니다.",수면 이완 담요 수면개선 힐링 편안 포근한 담요,ko,2025-01-15,naver_blog,date,rule_based_custom_korean_lexicon_v1
수면-이완,"따뜻한 햇살, 목덜미에 닿는 안온한 손길",부드러운 손길로 근육을 이완시키면 몸과 마음이 편안해지는 것을 느낄 수 있습니다. 스트레스... '목과 어깨 마사지'는 이러한 문제를 예방하고 개선하는 데 효과적입니다. 뭉친 근육을 풀어주어 건강한 일상을... ,mf9knvyw님의 블로그,20260304,https://blog.naver.com/mf9knvyw/224204209218,0,"긍정과 부정이 혼재하거나 뚜렷한 감정 표현이 적어, 수면·이완(담요/수면 보조/힐링 관련) 제품에 대한 평가에 대해 중립에 가까운 평가가 많습니다.",수면 이완 담요 수면개선 힐링 편안 포근한 담요,ko,2025-01-15,naver_blog,date,rule_based_custom_korean_lexicon_v1
수면-이완,"원적외선 휴대용 온열 안대, 지친 눈과 코에 꿀잠 선물! 이... ","꿀잠 부르는 자동 타이머와 포근한 착용감 많은 분들이 이 제품을 잠들기 전에 사용하면서 어느 순간... 또한, 편안한 숙면을 돕는 수면 보조템을 찾는 분들이나, 따뜻한 온기로 온몸의 긴장을 풀고 싶은... ",일상이 축제,20260304,https://blog.naver.com/plamoworks/224203811997,0,"긍정과 부정이 혼재하거나 뚜렷한 감정 표현이 적어, 수면·이완(담요/수면 보조/힐링 관련) 제품에 대한 평가에 대해 중립에 가까운 평가가 많습니다.",수면 이완 담요 수면개선 힐링 편안 포근한 담요,ko,2025-01-15,naver_blog,date,rule_based_custom_korean_lexicon_v1
수면-이완,여름철 다한증 완화를 위한 효과적인 땀 관리 방법,"첫째, 생활 습관 개선이 필요합니다. 과도한 스트레스나 긴장 상태는 땀 분비를 증가시킬 수 있습니다.... 여름철에는 이불 대신 가벼운 담요를 사용하여 수면 중에도 편안하고 쾌적한 환경을 유지하는 것이... ",Cocostory_,20260304,https://blog.naver.com/sugk0488kim/224204264829,1,"대체로 약한 긍정 경향이 나타나며, 수면·이완(담요/수면 보조/힐링 관련) 제품에 대한 평가에서 기본적인 효용과 실용성이 인정됩니다.",수면 이완 담요 수면개선 힐링 편안 포근한 담요,ko,2025-01-15,naver_blog,date,rule_based_custom_korean_lexicon_v1
수면-이완,[수면오일 천연에센셜오일 추천] 르에르베 아로마테라피오일... ,"향기테라피 “향을 맡는 순간, 힐링과 숙면이 시작됩니다.” 하루의 끝, 한 방울의 향기로 깊고 편안한 밤을 경험해 보세요! 향기테라피 수면오일로 완전 추천합니다! 구매링크 #수면오일 #천연에센셜오일... ",AnotherSky,20260304,https://blog.naver.com/umeshu/224204353792,4,"전반적으로 강한 긍정 경향이 나타나며, 수면·이완(담요/수면 보조/힐링 관련) 제품에 대한 평가에서 기능과 활용도에 대한 만족도가 높습니다.",수면 이완 담요 수면개선 힐링 편안 포근한 담요,ko,2025-01-15,naver_blog,date,rule_based_custom_korean_lexicon_v1
수면-이완,감성 잠옷 컬러로 숙면을 위한 색상 선택,"수많은 수면 개선 방법 중, 간과하기 쉬운 요소가 바로 ‘잠옷의 색상’입니다. 우리의 눈이 마지막으로 마주하는 색, 잠들기 전 피부에 닿는 감촉만큼이나 시각적인 편안함은 수면의 질을 좌우합니다. 저는... ",yonginnoosoo님의 블로그,20260304,https://blog.naver.com/yonginnoosoo/224204385623,1,"대체로 약한 긍정 경향이 나타나며, 수면·이완(담요/수면 보조/힐링 관련) 제품에 대한 평가에서 기본적인 효용과 실용성이 인정됩니다.",수면 이완 담요 수면개선 힐링 편안 포근한 담요,ko,2025-01-15,naver_blog,date,rule_based_custom_korean_lexicon_v1
수면-이완,[당산요가][선유도요가] 하루 마무리 하는 명상 요가 동작을... ,"수카아사나 – 편안한 명상 자세 **Sukhasana**는 가장 기본이 되는 명상 자세입니다. 바닥에 앉아 다리를... 스트레스 호르몬 분비를 낮추고, 수면의 질을 개선하며, 집중력을 높이는 데도 긍정적인 영향을... ","편안한 한 숨, 평온한 하루",20260304,https://blog.naver.com/dangsan0076/224204466058,1,"대체로 약한 긍정 경향이 나타나며, 수면·이완(담요/수면 보조/힐링 관련) 제품에 대한 평가에서 기본적인 효용과 실용성이 인정됩니다.",수면 이완 담요 수면개선 힐링 편안 포근한 담요,ko,2025-01-15,naver_blog,date,rule_based_custom_korean_lexicon_v1
수면-이완,자기 전 먹어도 속 편한 요리 3가지 이제는 걱정말고 드세요,"실제로 우리 몸은 수면 중에 소화 기관도 휴식을 취해야 하므로, 야식으로 기름지거나 자극적인 음식을... 요리는 포근한 식감 덕분에 심리적인 허기까지 달래줍니다. 따뜻한 성질의 오트밀은 배를 따뜻하게... ",한옥마을물갈비,20260304,https://blog.naver.com/hanok_mulgalbi/224204468428,0,"긍정과 부정이 혼재하거나 뚜렷한 감정 표현이 적어, 수면·이완(담요/수면 보조/힐링 관련) 제품에 대한 평가에 대해 중립에 가까운 평가가 많습니다.",수면 이완 담요 수면개선 힐링 편안 포근한 담요,ko,2025-01-15,naver_blog,date,rule_based_custom_korean_lexicon_v1
수면-이완,[별자리운세]3월 5일 재미로 보는 오늘의 운세,관계 개선에 긍정적인 작용을 합니다. 전체적으로 주변 사람들과 조화를 이루며 본인의 내면을... ☘️ 행운템: 몽글몽글한 질감의 쿠션은 휴식 시간에 몸을 편안하게 받쳐주어 근육의 긴장을 해소하고 포근한... ,생활정보·법·결혼·여행·쇼핑까지 모두 한곳에!,20260304,https://blog.naver.com/goodlucia/224204598353,1,"대체로 약한 긍정 경향이 나타나며, 수면·이완(담요/수면 보조/힐링 관련) 제품에 대한 평가에서 기본적인 효용과 실용성이 인정됩니다.",수면 이완 담요 수면개선 힐링 편안 포근한 담요,ko,2025-01-15,naver_blog,date,rule_based_custom_korean_lexicon_v1
수면-이완,한방병원 방문 후 건강하게 몸 관리하는 지혜로운 방법,"특히, 한방 치료는 자연 치유력을 높이는 데 중점을 두므로, 생활 습관 개선이 필수적입니다. 식습관... 또한, 좋아하는 음악을 듣거나 힐링 영상을 보면서 편안하게 휴식을 취하는 것도 좋은 방법입니다.... ",좋아했잖아,20260304,https://blog.naver.com/e58dxx0q3sfsztf/224203262371,2,"전반적으로 강한 긍정 경향이 나타나며, 수면·이완(담요/수면 보조/힐링 관련) 제품에 대한 평가에서 기능과 활용도에 대한 만족도가 높습니다.",수면 이완 담요 수면개선 힐링 편안 포근한 담요,ko,2025-01-15,naver_blog,date,rule_based_custom_korean_lexicon_v1
수면-이완,일상 속 만성 피로 바디 케어로 현명하게 관리하는 법,"이는 피로 물질의 배출을 촉진하고 유연성을 높여 몸의 움직임을 더욱 편안하게 만들죠. 나아가 아로마 오일을 활용한 관리 등은 스트레스 감소와 불안 완화에 기여하며, 깊은 이완을 통해 수면의 질까지... ",높은 비,20260304,https://blog.naver.com/comparefqgg/224203774295,0,"긍정과 부정이 혼재하거나 뚜렷한 감정 표현이 적어, 수면·이완(담요/수면 보조/힐링 관련) 제품에 대한 평가에 대해 중립에 가까운 평가가 많습니다.",수면 이완 담요 수면개선 힐링 편안 포근한 담요,ko,2025-01-15,naver_blog,date,rule_based_custom_korean_lexicon_v1
수면-이완,"부드러운 담요, 마곡 마사지 위로 감싸는 안도감","마곡의 편안한 분위기는 지친 심신을 달래주기에 충분합니다. 마곡에서 특별한 힐링 타임을 가져보는... 혈액 순환을 촉진하여 신진대사를 활발하게 하고, 림프의 흐름을 개선하여 몸속 노폐물 배출을 돕습니다.... ",eqfo129c님의 블로그,20260304,https://blog.naver.com/eqfo129c/224203726968,2,"전반적으로 강한 긍정 경향이 나타나며, 수면·이완(담요/수면 보조/힐링 관련) 제품에 대한 평가에서 기능과 활용도에 대한 만족도가 높습니다.",수면 이완 담요 수면개선 힐링 편안 포근한 담요,ko,2025-01-15,naver_blog,date,rule_based_custom_korean_lexicon_v1
수면-이완,"플래닛스트레치, 특별한 공간을 소개합니다","대기실에 마련된 7개의 족욕세면대와 쇼파, 잠시 힐링하고 운동을 시작해보세요^^ 수돗물을 온천수... 다리부종제거, 수면의 질 개선 효과가 있다네요 플래닛 스트레치의 특수한 족욕시설에 발을 담그면... ",PLANET_STRETCH,20260304,https://blog.naver.com/stretchplanet/224204049040,2,"전반적으로 강한 긍정 경향이 나타나며, 수면·이완(담요/수면 보조/힐링 관련) 제품에 대한 평가에서 기능과 활용도에 대한 만족도가 높습니다.",수면 이완 담요 수면개선 힐링 편안 포근한 담요,ko,2025-01-15,naver_blog,date,rule_based_custom_korean_lexicon_v1
수면-이완,"지친 일상, 손, 발 마사지로 활력 되찾고 숙면까지! 힐링 마사지","힐링 마사지 스트레스 해소, 손과 손바닥 마사지 비법 혹시 스트레스가 당신의 손끝까지 뻗어있다는... 잠들기 전 가벼운 마사지는 깊고 편안한 잠을 선물할 것입니다. 규칙적인 마사지는 수면의 질을 향상시키고... ",행복한여행을기록하다,20260304,https://blog.naver.com/vl322n38/224203721690,2,"전반적으로 강한 긍정 경향이 나타나며, 수면·이완(담요/수면 보조/힐링 관련) 제품에 대한 평가에서 기능과 활용도에 대한 만족도가 높습니다.",수면 이완 담요 수면개선 힐링 편안 포근한 담요,ko,2025-01-15,naver_blog,date,rule_based_custom_korean_lexicon_v1
수면-이완,[인하대역pt] 다이어트 중이라면 꼭 알아야 할 수면과 체중 관계,"수면 환경 개선: 어두운 조명, 적정 온도, 편안한 침구 등을 활용해 쾌적한 잠자리를 만드세요. 취침 전... 가벼운 스트레칭 및 명상: 몸과 마음을 이완시켜 숙면에 도움을 줍니다. 필요 시 전문가 상담: 수면... ",인싸짐학익점,20260304,https://blog.naver.com/inssagym2/224203724705,2,"전반적으로 강한 긍정 경향이 나타나며, 수면·이완(담요/수면 보조/힐링 관련) 제품에 대한 평가에서 기능과 활용도에 대한 만족도가 높습니다.",수면 이완 담요 수면개선 힐링 편안 포근한 담요,ko,2025-01-15,naver_blog,date,rule_based_custom_korean_lexicon_v1
수면-이완,"포근한 캐시미어 담요, 판교 필라테스의 따스한 시작",이는 자세 개선에 도움을 주며 동시에 힙업 효과까지 얻을 수 있습니다. 꾸준한 반복은 놀라운 변화를... 효과적인 이완을 경험할 수 있습니다. 스트레스 해소는 물론 수면의 질 향상에도 기여합니다. 편안한 밤을... ,국민폐차,20260304,https://blog.naver.com/likeble52922/224203371701,2,"전반적으로 강한 긍정 경향이 나타나며, 수면·이완(담요/수면 보조/힐링 관련) 제품에 대한 평가에서 기능과 활용도에 대한 만족도가 높습니다.",수면 이완 담요 수면개선 힐링 편안 포근한 담요,ko,2025-01-15,naver_blog,date,rule_based_custom_korean_lexicon_v1
수면-이완,마사지와 음악의 조화 손끝으로 전하는 자율신경 안정 비법,"손가락 하나하나를 부드럽게 주무르고, 관절 마디마디를 섬세하게 눌러주면 혈액 순환 개선에 도움을... 마사지와 음악, 힐링 시너지 마사지와 편안한 음악은 마치 최고의 듀엣 같습니다. 마사지가 몸의 긴장을... ",하이듀의 슬기로운,20260304,https://blog.naver.com/metheglin49598/224203373016,5,"전반적으로 강한 긍정 경향이 나타나며, 수면·이완(담요/수면 보조/힐링 관련) 제품에 대한 평가에서 기능과 활용도에 대한 만족도가 높습니다.",수면 이완 담요 수면개선 힐링 편안 포근한 담요,ko,2025-01-15,naver_blog,date,rule_based_custom_korean_lexicon_v1
