category,title,description,blogger,date,link,sentiment_score,sentiment_interpretation,search_query,search_lang,collected_at,platform,sort_option,sentiment_method
에너지-조명,"♥파츠,장비 출품리스트,중고,신품 모두 취급♥(46)","KLA Tencor 50-1010 Prometrix, Precision Light Source, 326953 16. AMAT 0020-04468 Coupler... AMAT 0190-35975 Endpoint Fiber Light, Pipe, Cable, Etch, Chamber, 424652 42. AMAT 0190-35975... ",LAYLA : www.layla-ec.com,20190207,https://blog.naver.com/laylaec2018/221460130693,0,"긍정과 부정이 혼재하거나 뚜렷한 감정 표현이 적어, 에너지-조명(수동발전 랜턴 등) 제품에 대한 평가에 대해 중립에 가까운 평가가 많습니다.",hand crank emergency lantern self powered flashlight emergency light,en,2025-01-15,naver_blog,date,rule_based_custom_korean_lexicon_v1
에너지-조명,"♥파츠,장비 출품리스트,중고,신품 모두 취급♥(49)",EMERGENCY CABLE ASSY 118. DET VIDEO 1 CABLE ASSY 119. DATA CUBE PWR CABLE ASSY 120. FAN... HAND SET FOR QUATRO 316. COUPLING DK 100/53 16MM 317. THUMB SCREW 318. Liner Tube DFA15/150... ,LAYLA : www.layla-ec.com,20190208,https://blog.naver.com/laylaec2018/221460661846,0,"긍정과 부정이 혼재하거나 뚜렷한 감정 표현이 적어, 에너지-조명(수동발전 랜턴 등) 제품에 대한 평가에 대해 중립에 가까운 평가가 많습니다.",hand crank emergency lantern self powered flashlight emergency light,en,2025-01-15,naver_blog,date,rule_based_custom_korean_lexicon_v1
에너지-조명,"♥파츠,장비 출품리스트,중고,신품 모두 취급♥(50)","Crank Coupling, Left Machining 152. HINGE LEFT, MACHINING RIGHT DOOR 153. Frame, DCM, Machining 154. Hinge RIFHT,Machining (Right Door) 155. Heat Exchanger Reservoir 156. 1.00' Port... ",LAYLA : www.layla-ec.com,20190208,https://blog.naver.com/laylaec2018/221460674117,0,"긍정과 부정이 혼재하거나 뚜렷한 감정 표현이 적어, 에너지-조명(수동발전 랜턴 등) 제품에 대한 평가에 대해 중립에 가까운 평가가 많습니다.",hand crank emergency lantern self powered flashlight emergency light,en,2025-01-15,naver_blog,date,rule_based_custom_korean_lexicon_v1
에너지-조명,"♥파츠,장비 출품리스트,중고,신품 모두 취급♥(53)","DELL Cable, CN-0NC074-25960 / Rev A01 / Dell Internal Cable With Plugs / PowerEd 28. DELL... Scaner, MS320-1G / Hand Held Scaner / Unitech 140. Blanl off 300mm PVD Chamber / Rev 003... ",LAYLA : www.layla-ec.com,20190208,https://blog.naver.com/laylaec2018/221460703566,0,"긍정과 부정이 혼재하거나 뚜렷한 감정 표현이 적어, 에너지-조명(수동발전 랜턴 등) 제품에 대한 평가에 대해 중립에 가까운 평가가 많습니다.",hand crank emergency lantern self powered flashlight emergency light,en,2025-01-15,naver_blog,date,rule_based_custom_korean_lexicon_v1
에너지-조명,"♥파츠,장비 출품리스트,중고,신품 모두 취급♥(54)","NERLITE LIGHT DIFFUSING ILLUMINATOR 78. PNEUMATIC SLIDER ONH710 79. VACUUM PUMP W/ FILTER... TEMPERATURE CONTROLLER AC POWERED 381. FORLINE #3, COMMON 316L, 5200 IPS/SHIMAD 382.... ",LAYLA : www.layla-ec.com,20190208,https://blog.naver.com/laylaec2018/221460709549,0,"긍정과 부정이 혼재하거나 뚜렷한 감정 표현이 적어, 에너지-조명(수동발전 랜턴 등) 제품에 대한 평가에 대해 중립에 가까운 평가가 많습니다.",hand crank emergency lantern self powered flashlight emergency light,en,2025-01-15,naver_blog,date,rule_based_custom_korean_lexicon_v1
에너지-조명,"♥파츠,장비 출품리스트,중고,신품 모두 취급♥(55)",Model 197 - EG&G Model 197 Signal Recovery Light Chopper EG&G 81. VQ2140-5LOB-N7 - VQ2140... C2-54-9-1 - Raychem Chemelex 64-00274 / C2-54-9-1 Self Regulating Heating Cable20' Raychem... ,LAYLA : www.layla-ec.com,20190208,https://blog.naver.com/laylaec2018/221460720434,0,"긍정과 부정이 혼재하거나 뚜렷한 감정 표현이 적어, 에너지-조명(수동발전 랜턴 등) 제품에 대한 평가에 대해 중립에 가까운 평가가 많습니다.",hand crank emergency lantern self powered flashlight emergency light,en,2025-01-15,naver_blog,date,rule_based_custom_korean_lexicon_v1
에너지-조명,"♥파츠,장비 출품리스트,중고,신품 모두 취급♥(58)","HINGE INLINE LEFT HAND/RIGHT HAND 216. GASLINE, PRCS PURGE CH3 TXZ MID MF ENDUR 217.... CABLE LIGHT PEN SELECT W/3 MONITORS 224. MFC 8160 30SLM H2 1/4VCR MTL NO HOV 15 225. MFCD980... ",LAYLA : www.layla-ec.com,20190208,https://blog.naver.com/laylaec2018/221460879661,0,"긍정과 부정이 혼재하거나 뚜렷한 감정 표현이 적어, 에너지-조명(수동발전 랜턴 등) 제품에 대한 평가에 대해 중립에 가까운 평가가 많습니다.",hand crank emergency lantern self powered flashlight emergency light,en,2025-01-15,naver_blog,date,rule_based_custom_korean_lexicon_v1
에너지-조명,"What’s in Your Bag, Anthropologists?","equipment, emergency granola bars, and—of course—scarves. What’s in your bag? Tammy... OxyLED flashlight; basic first aid (Band-Aids, antibiotic ointment, and antiseptic wipes)... ",MUSEO ANTHROPOLOGY,20190213,https://blog.naver.com/hirodo/221464595679,0,"긍정과 부정이 혼재하거나 뚜렷한 감정 표현이 적어, 에너지-조명(수동발전 랜턴 등) 제품에 대한 평가에 대해 중립에 가까운 평가가 많습니다.",hand crank emergency lantern self powered flashlight emergency light,en,2025-01-15,naver_blog,date,rule_based_custom_korean_lexicon_v1
에너지-조명,"Monday February 4,2019 at 11;00  Hong Kong Museum 에서... ","of light and dark silstone. On the land surrounding the lake a great variety of plants... For plants these are sufficient light, water and nutrients from the soil or air to provide the... ",최갑순사는이야기,20190307,https://blog.naver.com/choigabs/221482405083,0,"긍정과 부정이 혼재하거나 뚜렷한 감정 표현이 적어, 에너지-조명(수동발전 랜턴 등) 제품에 대한 평가에 대해 중립에 가까운 평가가 많습니다.",hand crank emergency lantern self powered flashlight emergency light,en,2025-01-15,naver_blog,date,rule_based_custom_korean_lexicon_v1
에너지-조명,세 스 나 172 훈 련 교 실 (Cessna 172 Training Guide),"Cessna는 1946 년에 Model 120을 생산하기 시작 했으며, 이 항공기는 동체는 aluminium으로, 날개는 fabric(천)으로 덮인 two-seat (2 인승) 경비행기(light planes)였습니다.... ",고송의 행복한 인생이야기,20190331,https://blog.naver.com/kimj0ngman/221501840685,0,"긍정과 부정이 혼재하거나 뚜렷한 감정 표현이 적어, 에너지-조명(수동발전 랜턴 등) 제품에 대한 평가에 대해 중립에 가까운 평가가 많습니다.",hand crank emergency lantern self powered flashlight emergency light,en,2025-01-15,naver_blog,date,rule_based_custom_korean_lexicon_v1
에너지-조명,LAYLA：반도체관련 장비 및 부품의 종합시장(40),"com/pd/1000000018_152362440481 ⇒0020-27436/COVER INDICATOR LIGHT/Applied Materials https:/www.layla-ec.com/pd/1000000018_152362440786 ⇒0020-27834/REAR PLATE, Q2 EXTRACTION/Applied... ",LAYLA : www.layla-ec.com,20190402,https://blog.naver.com/laylaec2018/221503771196,0,"긍정과 부정이 혼재하거나 뚜렷한 감정 표현이 적어, 에너지-조명(수동발전 랜턴 등) 제품에 대한 평가에 대해 중립에 가까운 평가가 많습니다.",hand crank emergency lantern self powered flashlight emergency light,en,2025-01-15,naver_blog,date,rule_based_custom_korean_lexicon_v1
에너지-조명,한글품명 -&gt; 영문품명 리스트,"DRESSER, HAND TYPE 배터리 충전기 BATTERY CHARGER 스팀 세척기 CLEANER, STEAM 타이밍 라이트 TIMING LIGHT 대변기 CLOSET 수위조절기 Water Level Regulator 수도용 새들붙이 분수전... ",정보네트워크망,20190411,https://blog.naver.com/ansannow/221510934941,0,"긍정과 부정이 혼재하거나 뚜렷한 감정 표현이 적어, 에너지-조명(수동발전 랜턴 등) 제품에 대한 평가에 대해 중립에 가까운 평가가 많습니다.",hand crank emergency lantern self powered flashlight emergency light,en,2025-01-15,naver_blog,date,rule_based_custom_korean_lexicon_v1
에너지-조명,[삼성 갤럭시 폴드] 벌써 문제가 있다고 외신이 난리입니다...... ,安寧하십니까? 2019년 4월 18일(木) 새벽 4시 20분입니다. (午後 12時 4分) ^^. 롯데 選手權이 水曜日부터인지를 몰랐습니다. KPGA 總賞金이 149.... ,조선닷컴 골프카페 매니저의 블로그,20190418,https://blog.naver.com/chyhkim/221516817613,-1,"대체로 약한 부정 경향이 나타나며, 에너지-조명(수동발전 랜턴 등) 제품에 대한 평가에서 일부 기능·편의성·성능에 대한 아쉬움이 보고됩니다.",hand crank emergency lantern self powered flashlight emergency light,en,2025-01-15,naver_blog,date,rule_based_custom_korean_lexicon_v1
에너지-조명,qq,"1 00:00:36,713 --&gt; 00:00:41,713 Subtitles by explosiveskull 2 00:00:41,715 --&gt; 00:00:43,848 (WIND WHISTLING) 3 00:01:03,782 --&gt; 00:01:05,782 (BREATHING HEAVILY) 4 00:01:27,049 --&gt; 00:01... ",귀남s,20190427,https://blog.naver.com/rhdrnlska3/221523860956,0,"긍정과 부정이 혼재하거나 뚜렷한 감정 표현이 적어, 에너지-조명(수동발전 랜턴 등) 제품에 대한 평가에 대해 중립에 가까운 평가가 많습니다.",hand crank emergency lantern self powered flashlight emergency light,en,2025-01-15,naver_blog,date,rule_based_custom_korean_lexicon_v1
에너지-조명,캡틴마블,"1 00:02:15,660 --&gt; 00:02:17,176 Do you know what time it is? 2 00:02:17,277 --&gt; 00:02:18,405 Can't sleep. 3 00:02:18,504 --&gt; 00:02:20,566 There are tabs for that. 4 00:02:21,171 --&gt; 00... ",wjdshrgjs님의블로그,20190428,https://blog.naver.com/wjdshrgjs/221524508577,0,"긍정과 부정이 혼재하거나 뚜렷한 감정 표현이 적어, 에너지-조명(수동발전 랜턴 등) 제품에 대한 평가에 대해 중립에 가까운 평가가 많습니다.",hand crank emergency lantern self powered flashlight emergency light,en,2025-01-15,naver_blog,date,rule_based_custom_korean_lexicon_v1
에너지-조명,송천고 영어 대박-첫 중간고사  - 인천 논현동 영어 내신 절대... ,One such emergency involved a leak in the pipe supplying water to the camp. The researchers assigned the boys to teams made up of members of both groups. (B) Then the two groups met. A series of... ,인천 논현동 KNS 연세 영어 학원,20190430,https://blog.naver.com/kns2302/221526204707,2,"전반적으로 강한 긍정 경향이 나타나며, 에너지-조명(수동발전 랜턴 등) 제품에 대한 평가에서 기능과 활용도에 대한 만족도가 높습니다.",hand crank emergency lantern self powered flashlight emergency light,en,2025-01-15,naver_blog,date,rule_based_custom_korean_lexicon_v1
에너지-조명,cm,"259 00:18:38,832 --&gt; 00:18:42,007 Lawson is our link to that light-speed engine! 260 00:18:43,244 --&gt; 00:18:44,713 And everything we're after. 261 00:18:52,299 --&gt; 00:18:53,302 Oh! 262... ",mkn11111님의 블로그,20190502,https://blog.naver.com/mkn11111/221527773293,0,"긍정과 부정이 혼재하거나 뚜렷한 감정 표현이 적어, 에너지-조명(수동발전 랜턴 등) 제품에 대한 평가에 대해 중립에 가까운 평가가 많습니다.",hand crank emergency lantern self powered flashlight emergency light,en,2025-01-15,naver_blog,date,rule_based_custom_korean_lexicon_v1
에너지-조명,의료기기 이상사례 표준코드,"insufficient, light or patchy) 15 1708 동맥류(Aneurysm) 16 1710 협심증(Angina) 17 2328 불안(Anxiety) 18 2491 대동맥 박리(Aortic Dissection) 19 1718 아프가 점수, 감소 또는 낮음(Apgar... ",하이거,20190504,https://blog.naver.com/htiger31/221529541993,0,"긍정과 부정이 혼재하거나 뚜렷한 감정 표현이 적어, 에너지-조명(수동발전 랜턴 등) 제품에 대한 평가에 대해 중립에 가까운 평가가 많습니다.",hand crank emergency lantern self powered flashlight emergency light,en,2025-01-15,naver_blog,date,rule_based_custom_korean_lexicon_v1
에너지-조명,산업용품해외구매는 '유에스일공일'로 문의주세요.... ,9 SA-4959-12 12V 3H210-08 2 Position 3 Way Pneumatic Air Hand Lever Operated Valve Solenoid... B2015-S85 4H210-085 Way Pneumatic Air Hand Lever Operated Valve Solenoid Valve Port 1/4... ,유에스일공일/유에스원오원,20190504,https://blog.naver.com/us101-01/221529580492,0,"긍정과 부정이 혼재하거나 뚜렷한 감정 표현이 적어, 에너지-조명(수동발전 랜턴 등) 제품에 대한 평가에 대해 중립에 가까운 평가가 많습니다.",hand crank emergency lantern self powered flashlight emergency light,en,2025-01-15,naver_blog,date,rule_based_custom_korean_lexicon_v1
에너지-조명,산업용품해외구매는 '유에스일공일'로 문의주세요.... ,"Air-powered Micro Die Grinder, Pencil Style 54,000 RPM 1/8 (3mm) Capacity Neiko 10671A 7... Led Light Magnifier & Desk Lamp Helping Hand with Magnifying Glass, 3.5X 12X Lens Helping Hand... ",유에스일공일/유에스원오원,20190505,https://blog.naver.com/us101-01/221530206028,0,"긍정과 부정이 혼재하거나 뚜렷한 감정 표현이 적어, 에너지-조명(수동발전 랜턴 등) 제품에 대한 평가에 대해 중립에 가까운 평가가 많습니다.",hand crank emergency lantern self powered flashlight emergency light,en,2025-01-15,naver_blog,date,rule_based_custom_korean_lexicon_v1
에너지-조명,산업용품해외구매는 '유에스일공일'로 문의주세요.... ,"Adjustable Light Settings, Balanced Base - Helping Hands Soldering Station by Psiven Helping Hands Third Hand Soldering Vise with Magnifying Glass Lens and Mini LED Flashlight - Six... ",유에스일공일/유에스원오원,20190505,https://blog.naver.com/us101-01/221530204914,0,"긍정과 부정이 혼재하거나 뚜렷한 감정 표현이 적어, 에너지-조명(수동발전 랜턴 등) 제품에 대한 평가에 대해 중립에 가까운 평가가 많습니다.",hand crank emergency lantern self powered flashlight emergency light,en,2025-01-15,naver_blog,date,rule_based_custom_korean_lexicon_v1
에너지-조명,산업용품해외구매는 '유에스일공일'로 문의주세요.... ,TDR900 Hand Held Time Domain Reflectometer and Cable Length Meter Meharbour High Precision Calibration Correction Electronic Scale Balance Weight Light Meters & Photometers Mei Xu DC... ,유에스일공일/유에스원오원,20190505,https://blog.naver.com/us101-01/221529893732,0,"긍정과 부정이 혼재하거나 뚜렷한 감정 표현이 적어, 에너지-조명(수동발전 랜턴 등) 제품에 대한 평가에 대해 중립에 가까운 평가가 많습니다.",hand crank emergency lantern self powered flashlight emergency light,en,2025-01-15,naver_blog,date,rule_based_custom_korean_lexicon_v1
에너지-조명,산업용품해외구매는 '유에스일공일'로 문의주세요.... ,"Paint Hand-Hold Hot Air Gun 110V 60W Auto Welding Automatic Feed Soldering Gun Electric... LED Light, Battery, Fast Charger, 2 Piece Drive Bits and Tool 2-1/2-to-1-1/2-Inch Conversion... ",유에스일공일/유에스원오원,20190505,https://blog.naver.com/us101-01/221530203969,0,"긍정과 부정이 혼재하거나 뚜렷한 감정 표현이 적어, 에너지-조명(수동발전 랜턴 등) 제품에 대한 평가에 대해 중립에 가까운 평가가 많습니다.",hand crank emergency lantern self powered flashlight emergency light,en,2025-01-15,naver_blog,date,rule_based_custom_korean_lexicon_v1
에너지-조명,산업용품해외구매는 '유에스일공일'로 문의주세요.... ,4) Pillow Block Bearings Solid Base 1-1/2 UCP208-24 self-Align (Qty.4) Premium UCF205-16... Optical Light Source SM 1310/1550nm FTTH Test Tool OPM OLS 1.25 in. and 1.5 in. ABS Threaded... ,유에스일공일/유에스원오원,20190505,https://blog.naver.com/us101-01/221529892608,0,"긍정과 부정이 혼재하거나 뚜렷한 감정 표현이 적어, 에너지-조명(수동발전 랜턴 등) 제품에 대한 평가에 대해 중립에 가까운 평가가 많습니다.",hand crank emergency lantern self powered flashlight emergency light,en,2025-01-15,naver_blog,date,rule_based_custom_korean_lexicon_v1
에너지-조명,산업용품해외구매는 '유에스일공일'로 문의주세요.... ,"산업용품 해외구매,수입대행사 유에스일공일 입니다. 국내에서 구매가 불가능한 산업용품,기계부속 ,전기,전자,금속, 바이오,화학약품 등등... ",유에스일공일/유에스원오원,20190505,https://blog.naver.com/us101-01/221529893061,0,"긍정과 부정이 혼재하거나 뚜렷한 감정 표현이 적어, 에너지-조명(수동발전 랜턴 등) 제품에 대한 평가에 대해 중립에 가까운 평가가 많습니다.",hand crank emergency lantern self powered flashlight emergency light,en,2025-01-15,naver_blog,date,rule_based_custom_korean_lexicon_v1
에너지-조명,산업용품해외구매는 '유에스일공일'로 문의주세요.... ,"Switch Light Sensor Light Controller Auto on Off Photo Control [15 Packs] 10 GramDry & Dry... Portable Hand Held Refractometer for Sugar Content Test 0437411, solenoid valve, applicable... ",유에스일공일/유에스원오원,20190505,https://blog.naver.com/us101-01/221529833817,0,"긍정과 부정이 혼재하거나 뚜렷한 감정 표현이 적어, 에너지-조명(수동발전 랜턴 등) 제품에 대한 평가에 대해 중립에 가까운 평가가 많습니다.",hand crank emergency lantern self powered flashlight emergency light,en,2025-01-15,naver_blog,date,rule_based_custom_korean_lexicon_v1
에너지-조명,산업용품해외구매는 '유에스일공일'로 문의주세요.... ,Room Hand Shadowless Light Surgical Examination lamp (90V-240V) TDOUBEAUTY Surgery Lamp 30W... Battery Powered - CE & RoHs Approved TEKTON 46133 3/8-Inch I.D. by 6-Foot 300 PSI Hybrid... ,유에스일공일/유에스원오원,20190505,https://blog.naver.com/us101-01/221529894065,0,"긍정과 부정이 혼재하거나 뚜렷한 감정 표현이 적어, 에너지-조명(수동발전 랜턴 등) 제품에 대한 평가에 대해 중립에 가까운 평가가 많습니다.",hand crank emergency lantern self powered flashlight emergency light,en,2025-01-15,naver_blog,date,rule_based_custom_korean_lexicon_v1
에너지-조명,산업용품해외구매는 '유에스일공일'로 문의주세요.... ,5x 420mm Working Distance Optical Glass with LED Head Light Lamp+Aluminum Box Blue Ochoos... Loop Powered Eng Units 째F 째C PSI % Decimal Points 3 Position Adjustabl Open Source Meter... ,유에스일공일/유에스원오원,20190505,https://blog.naver.com/us101-01/221529836110,0,"긍정과 부정이 혼재하거나 뚜렷한 감정 표현이 적어, 에너지-조명(수동발전 랜턴 등) 제품에 대한 평가에 대해 중립에 가까운 평가가 많습니다.",hand crank emergency lantern self powered flashlight emergency light,en,2025-01-15,naver_blog,date,rule_based_custom_korean_lexicon_v1
에너지-조명,산업용품해외구매는 '유에스일공일'로 문의주세요.... ,Select Motion-Triggered Light OR Motion-Triggered Alarm with Loud 100dB ??Uses Infrared... Kit Hand Pump Pressurized Keg with 32 oz. Cleaner Draftec DTPCKCLR Deluxe Hand Pump Pressurized... ,유에스일공일/유에스원오원,20190505,https://blog.naver.com/us101-01/221529835170,0,"긍정과 부정이 혼재하거나 뚜렷한 감정 표현이 적어, 에너지-조명(수동발전 랜턴 등) 제품에 대한 평가에 대해 중립에 가까운 평가가 많습니다.",hand crank emergency lantern self powered flashlight emergency light,en,2025-01-15,naver_blog,date,rule_based_custom_korean_lexicon_v1
에너지-조명,Tips for Camping with Kids (From REI Advice),Is your teen a light sleeper and a late riser? Remember earplugs so your teen can sleep in... own flashlight or headlamp. Kids may enjoy having a string of solar- or battery-powered... ,새벽녘 그리고 둘이 하나가 된다는 것~,20190605,https://blog.naver.com/rius1072/221554931870,0,"긍정과 부정이 혼재하거나 뚜렷한 감정 표현이 적어, 에너지-조명(수동발전 랜턴 등) 제품에 대한 평가에 대해 중립에 가까운 평가가 많습니다.",hand crank emergency lantern self powered flashlight emergency light,en,2025-01-15,naver_blog,date,rule_based_custom_korean_lexicon_v1
에너지-조명,*The Case for Space*,"operations, powered by nuclear fusion. But is that really the cheapest way to get more... of light.” There are many interesting ancillary points, such as using the length of the... ",Marginal REVOLUTION - Small Steps Toward A Much Better World,20190611,https://marginalrevolution.com/marginalrevolution/2019/06/the-case-for-space.html,0,"긍정과 부정이 혼재하거나 뚜렷한 감정 표현이 적어, 에너지-조명(수동발전 랜턴 등) 제품에 대한 평가에 대해 중립에 가까운 평가가 많습니다.",hand crank emergency lantern self powered flashlight emergency light,en,2025-01-15,naver_blog,date,rule_based_custom_korean_lexicon_v1
에너지-조명,A woman’s responsibility for everyone else’s spills,"car emergency kit with the jumping cables and Mylar blanket and heat packs. That definitely... to hand. fast forward, I'm presenting as male and suddenly i'm not supposed to carry a... ",MetaFilter | Community Weblog,20190717,https://www.metafilter.com/182040/A-womans-responsibility-for-everyone-elses-spills,0,"긍정과 부정이 혼재하거나 뚜렷한 감정 표현이 적어, 에너지-조명(수동발전 랜턴 등) 제품에 대한 평가에 대해 중립에 가까운 평가가 많습니다.",hand crank emergency lantern self powered flashlight emergency light,en,2025-01-15,naver_blog,date,rule_based_custom_korean_lexicon_v1
에너지-조명,[2019 디 오픈 랩업] 14번 홀에서 플리트우드가 더블 보기로... ,"Michael Bamberger: What impressed me most about Shane Lowry was Shane Lowry his own self... But in the cold light of day, this week has reiterated that Tiger can still win, but the... ",조선닷컴 골프카페 매니저의 블로그,20190724,https://blog.naver.com/yhkim13/221593726317,0,"긍정과 부정이 혼재하거나 뚜렷한 감정 표현이 적어, 에너지-조명(수동발전 랜턴 등) 제품에 대한 평가에 대해 중립에 가까운 평가가 많습니다.",hand crank emergency lantern self powered flashlight emergency light,en,2025-01-15,naver_blog,date,rule_based_custom_korean_lexicon_v1
에너지-조명,역대 고3 모의고사 + 수능 어휘 빈도 리스트 :: 대한민국... ,55 hand: 55 part: 55 study: 55 go: 54 having: 54 nature: 54 never: 54 since: 54 themselves... 27 light: 27 live: 27 love: 27 mean: 27 memory: 27 open: 27 phillip: 27 quality: 27 room: 27... ,대한민국 영어공장 (내신/수능 워크북) :: 대한민국 영어공장 (내신/수능 워크북),20190724,https://wayne.tistory.com/1184,0,"긍정과 부정이 혼재하거나 뚜렷한 감정 표현이 적어, 에너지-조명(수동발전 랜턴 등) 제품에 대한 평가에 대해 중립에 가까운 평가가 많습니다.",hand crank emergency lantern self powered flashlight emergency light,en,2025-01-15,naver_blog,date,rule_based_custom_korean_lexicon_v1
에너지-조명,2019 중3 교과서 어휘 빈도 리스트 :: 대한민국 영어공장 (내신... ,28 hand: 28 idea: 28 instead: 28 javert: 28 language: 28 problems: 28 sea: 28 trees: 28... 15 light: 15 line: 15 moment: 15 natural: 15 north: 15 officer: 15 passed: 15 prince: 15 race... ,대한민국 영어공장 (내신/수능 워크북) :: 대한민국 영어공장 (내신/수능 워크북),20190724,https://wayne.tistory.com/1187,0,"긍정과 부정이 혼재하거나 뚜렷한 감정 표현이 적어, 에너지-조명(수동발전 랜턴 등) 제품에 대한 평가에 대해 중립에 가까운 평가가 많습니다.",hand crank emergency lantern self powered flashlight emergency light,en,2025-01-15,naver_blog,date,rule_based_custom_korean_lexicon_v1
에너지-조명,'19년 6월 파리에어쇼에 등장한 신규 항공기,"Seating five, and powered by a single Safran Arrius 2R turboshaft, the helicopter flew at... and emergency medical services. VIP customers can fit the Mecaer MAGnificent interior with... ",시간부자의 갓성비 라이프,20190730,https://blog.naver.com/siriusb/221599831659,0,"긍정과 부정이 혼재하거나 뚜렷한 감정 표현이 적어, 에너지-조명(수동발전 랜턴 등) 제품에 대한 평가에 대해 중립에 가까운 평가가 많습니다.",hand crank emergency lantern self powered flashlight emergency light,en,2025-01-15,naver_blog,date,rule_based_custom_korean_lexicon_v1
에너지-조명,2019-2020 수능완성에 나타난 단어 빈도수 :: 대한민국... ,10 hand: 10 holonyak: 10 job: 10 largest: 10 lot: 10 master: 10 meet: 10 million: 10 money... 9 light: 9 looking: 9 media: 9 minutes: 9 months: 9 needed: 9 organisms: 9 organization: 9... ,대한민국 영어공장 (내신/수능 워크북) :: 대한민국 영어공장 (내신/수능 워크북),20190805,https://wayne.tistory.com/1233,0,"긍정과 부정이 혼재하거나 뚜렷한 감정 표현이 적어, 에너지-조명(수동발전 랜턴 등) 제품에 대한 평가에 대해 중립에 가까운 평가가 많습니다.",hand crank emergency lantern self powered flashlight emergency light,en,2025-01-15,naver_blog,date,rule_based_custom_korean_lexicon_v1
